show_id,type,title,director,director_num,cast,cast_num,country,country_num,date_added,weekday_added,day_added,month_added,year_added,release_year,rating,duration,season,serial,listed_in,listed_in_num
80242926,Movie,The Princess Switch,,,"Vanessa Hudgens, Sam Palladio, Nick Sagar, Suanne Braun, Mark Fleischmann, Amy Griffiths, Sara Stewart, Pavel Douglas, Robin Soans, Calliope Taylor, Natali Yura, Alexa Adeosun",12,United States,1,"November 16, 2018",Friday,16,11,2018,2018,TV-PG,102,0,0,"Children & Family Movies, Dramas, Romantic Movies",3
80242950,TV Show,Smoking,,,"Ryo Ishibashi, Nobuaki Kaneko, Tomomi Maruyama, Kaito Yoshimura",4,Japan,1,"July 27, 2018",Friday,27,7,2018,2018,TV-MA,,1,1,"Crime TV Shows, International TV Shows, TV Action & Adventure",3
80243216,TV Show,The InBESTigators,,,"Abby Bergman, Anna Cooke, Aston Droomer, Jamil Smyth-Secka, James Saunders, Maria Angelico, Eliza Ong",7,Australia,1,"August 9, 2019",Friday,9,8,2019,2019,TV-G,,1,1,"Kids' TV, TV Comedies",2
80243473,TV Show,True: Wonderful Wishes,,,"Michela Luci, Jamie Watson, Anna Claire Bartlam, Dante Zee, Eric Peterson",5,,,"June 15, 2018",Friday,15,6,2018,2018,TV-Y,,1,1,Kids' TV,1
80243582,TV Show,True: Magical Friends,,,"Michela Luci, Jamie Watson, Anna Claire Bartlam, Dante Zee, Eric Peterson",5,,,"June 15, 2018",Friday,15,6,2018,2018,TV-Y,,1,1,Kids' TV,1
80243728,TV Show,Deadwind,,,"Pihla Viitala, Lauri Tilkanen, Jani Volanen, Tommi Korpela, Pirjo Lonka, Riku Nieminen, Pamela Tola, Jonna Järnefelt, Raimo Grönberg",9,"Finland, Germany",2,"August 23, 2018",Thursday,23,8,2018,2018,TV-MA,,1,1,"Crime TV Shows, International TV Shows, TV Dramas",3
80243899,TV Show,Behind the Newsroom,,,"Pok Piyatida Woramusik, Willie Ruengrit McIntosh, Charebelle Lanlalin, Tono Pakin Kumwilaisuk, Point Cholawit Meetongcom, Cee Hathaiphat, Pitta Na Pattalung, Ae Sasikarn Aphichartworasilp, Louis Pongphan Petchbuntoon, Sawitree Samipak",10,,,"September 14, 2018",Friday,14,9,2018,2015,TV-14,,1,1,"International TV Shows, Romantic TV Shows, TV Dramas",3
80244228,TV Show,Beauty and the Bitches,,,"Methinee Kingpayome, Son Songpaisarn, Yingying Sarucha, Pim Pimjira Jaroenlak, Jespipat Tilapornputt, Groupz Chutharut Anusin, Aon Korakot Tunkaew, Raviyanun Takerd, Nat Thephussadin Na Ayutthaya, Bam Pakakanya Charoenyos, Eye Warapairin Laphatsanitirot, Pemy Peramin Thabkaew, Darin Hansen, Hongyok Pornphan Rerkatakarn, Rattanapond Klinkulabhiran, Oliver Pupart, Organ Wacharapolmek, Patiparn Pataweekarn, Yuthana Puengklarng, Ak Akarat, Point Cholawit Meetongcom, Copter Phumin, Koii Korakod, Mila Thanapa, Mild Anis Suwit",25,,,"April 23, 2019",Tuesday,23,4,2019,2016,TV-14,,2,1,"International TV Shows, Romantic TV Shows, TV Comedies",3
80244246,TV Show,Blood & Treasures,,,"Nawat Kulrattanarak, Woranuch Wongsawan, Jespipat Tilapornputt, Paramej Noiam, Phutharit Prombandal",5,,,"July 14, 2018",Saturday,14,7,2018,2016,TV-14,,1,1,"International TV Shows, TV Dramas, TV Sci-Fi & Fantasy",3
80244271,TV Show,Revenge,,,"Lalita Panyopas, Saksit Tangtong, Tao Somchai Khemklad, Tack Parunyu Rojanawuttitum, Pongsatorn Jongwilas, Chaleumpol Tikumpornteerawong, Akarin Akaranitimaytharatt, Kanthi Pitithan, Plerng Pollapakk Vacharaponghiran, Kritteera Inpornwijit",10,,,"May 2, 2019",Thursday,2,5,2019,2017,TV-MA,,1,1,"Crime TV Shows, International TV Shows, TV Dramas",3
80244363,TV Show,Fatal Destiny,,,"Arucha Tosawat, Nappon Gomarachun, Phakin Khamwilaisak, Ratchawin Wongviriya, Penpak Sirikul, Saksit Tangtong",6,,,"July 13, 2018",Friday,13,7,2018,2016,TV-14,,1,1,"Crime TV Shows, International TV Shows, TV Action & Adventure",3
80244539,TV Show,Reality of Dream,,,"Sean Jindachot, Jintanutda Lummakanon, Charebelle Lanlalin, Aon Korakot Tunkaew, Attaporn Teemakorn, Rath Rattasin Nalintanapat, Ak Akarat, Geng Wayo Assawarungruang, Pemy Peramin Thabkaew",9,,,"July 31, 2018",Tuesday,31,7,2018,2015,TV-14,,1,1,"International TV Shows, Romantic TV Shows, TV Dramas",3
80244567,TV Show,Dad's Army,,,"Arthur Lowe, John Le Mesurier, Clive Dunn, John Laurie, Arnold Ridley, Ian Lavender, James Beck, Bill Pertwee",8,United Kingdom,1,"March 31, 2018",Saturday,31,3,2018,1977,TV-PG,,10,1,"British TV Shows, Classic & Cult TV, TV Comedies",3
80244601,TV Show,Castle of Stars,,,"Chaiyapol Pupart, Jintanutda Lummakanon, Worrawech Danuwong, Ornjira Lamwilai, Yong Armchair, Keerati Mahapreukpong, Akarat Nimitchai, Kornpassorn Duaysianklao, Nattapong Chartpong",9,,,"September 7, 2018",Friday,7,9,2018,2015,TV-14,,1,1,"International TV Shows, Romantic TV Shows, TV Comedies",3
80244627,TV Show,Two Sentence Horror Stories,,,"Nicole Kang, Jim Parrack, Tara Pacheco, Christopher Shyer, Kimberley Wong, Wai Ching Ho, Greta Quispe, Zaria Degenhardt, Uly Schlesinger, Kate Jennings Grant, Aleyse Shannon, Guillermo Arribas, Jaiden Smith, Pepper Binkley, Mikelle Wright-Matos, Melinda Mo",16,United States,1,"September 20, 2019",Friday,20,9,2019,2019,TV-14,,1,1,"TV Horror, Teen TV Shows",2
80244679,Movie,A 3 Minute Hug,Everardo González,1,,,"Mexico, United States",2,"October 28, 2019",Monday,28,10,2019,2019,TV-PG,28,0,0,"Documentaries, International Movies",2
80244680,Movie,A Tale of Two Kitchens,Trisha Ziff,1,,,,,"May 22, 2019",Wednesday,22,5,2019,2019,TV-G,30,0,0,"Documentaries, International Movies",2
80244681,Movie,After the Raid,Rodrigo Reyes,1,,,"United States, Mexico",2,"December 19, 2019",Thursday,19,12,2019,2019,TV-PG,25,0,0,"Documentaries, International Movies",2
80244682,Movie,Birders,Otilia Portillo Padua,1,,,"United States, Mexico",2,"September 25, 2019",Wednesday,25,9,2019,2019,TV-G,38,0,0,"Documentaries, International Movies",2
80244700,TV Show,Nobody's Looking,,,"Victor Lamoglia, Júlia Rabello, Kéfera Buchmann, Augusto Madeira, Danilo de Moura, Leandro Ramos, Telma Souza, Priscila Sol, Wallie Ruy, Maurício de Barros, Hermínio Ribeiro",11,Brazil,1,"November 22, 2019",Friday,22,11,2019,2019,TV-MA,,1,1,"International TV Shows, TV Comedies, TV Dramas",3
80244783,TV Show,Malibu Rescue: The Series,,,"Ricardo Hurtado, Breanna Yde, Jackie R. Jacobson, Abby Donnelly, Alkoya Brunson, Jeremy Howard, JT Neal, Bryana Salaz, Ian Ziering, Camaron Engels",10,United States,1,"June 3, 2019",Monday,3,6,2019,2019,TV-G,,1,1,"Kids' TV, TV Action & Adventure, TV Comedies",3
80244846,TV Show,Dolly Parton's Heartstrings,,,"Dolly Parton, Julianne Hough, Kimberly Williams-Paisley, Dallas Roberts, Melissa Leo, Andy Mientus, Katie Stevens, Michael J. Willett, Aidan Langford, Ray McKinnon, Delta Burke, Gerald McRaney, Ben Lawson, Brooke Elliott, Michele Weaver, Tim Reid, Sarah Shahi, Rochelle Aytes, Jessica Collins, Tammy Lynn Michaels, Robert Taylor, Holly Taylor, Shane Paul McGhie, Mary Lane Haskell, Camryn Manheim, Bellamy Young, Patricia Wettig, Timothy Busfield, Tom Brittney, Virginia Gardner, Colin O'Donoghue, Willa Fitzgerald, David Denman, Vanessa Rubio, Mac Davis, Kathleen Turner, Ginnifer Goodwin, Kyle Bornheimer, Tyler Crumley, Mary Donnelly Haskell, Ed Amatrudo",41,United States,1,"November 22, 2019",Friday,22,11,2019,2019,TV-14,,1,1,TV Dramas,1
80244848,Movie,Loudon Wainwright III: Surviving Twin,Christopher Guest,1,Loudon Wainwright III,1,,,"November 13, 2018",Tuesday,13,11,2018,2018,TV-14,92,0,0,Music & Musicals,1
80244929,TV Show,Inside the Mossad,,,,,Israel,1,"January 29, 2019",Tuesday,29,1,2019,2017,TV-14,,1,1,"Docuseries, International TV Shows",2
80244992,Movie,Ethirmarai,,,"Ramanathan, Rakesh",2,India,1,"April 1, 2018",Sunday,1,4,2018,2018,TV-14,91,0,0,"International Movies, Music & Musicals, Thrillers",3
80244996,TV Show,Street Food,,,,,United States,1,"April 26, 2019",Friday,26,4,2019,2019,TV-G,,1,1,Docuseries,1
80245117,TV Show,Exhibit A,,,,,United States,1,"June 28, 2019",Friday,28,6,2019,2019,TV-MA,,1,1,"Crime TV Shows, Docuseries, Science & Nature TV",3
80245262,TV Show,Singapore Social,,,"Nicole Ong, Mae Tan, Sukki Singapora, Vinny Sharp, Paul Foster, Tabitha Nauser",6,"Singapore, United States",2,"November 22, 2019",Friday,22,11,2019,2019,TV-MA,,1,1,"International TV Shows, Reality TV",2
80245299,TV Show,Ponysitters Club,,,"Morgan Neundorf, Madeline Leon, Khiyla Aynne, Cailan Laine Punnewaert, Zyon Allen, Maya Franzoi, Victoria Tomazelli, Hugh Wilson, Diana Chrisman",9,Canada,1,"November 16, 2018",Friday,16,11,2018,2018,TV-Y7,,2,1,"Kids' TV, TV Dramas",2
80245353,TV Show,Basketball or Nothing,,,,,United States,1,"August 2, 2019",Friday,2,8,2019,2019,TV-PG,,1,1,"Docuseries, Reality TV",2
80986797,TV Show,Forest of Piano,,,"Soma Saito, Junichi Suwabe, Natsuki Hanae, Yuichi Nakamura, Kenn, Aoi Yuki, Mariya Ise, Katsuyuki Konishi, Toshiyuki Toyonaga, Koji Yusa, Hiroshi Yanaka, Ryoko Shiraishi, Yo Taichi, Marie Miyake, Ryo Hirohashi, Motoko Kumai, Maaya Sakamoto, Hideyuki Tanaka, Bin Shimada",19,Japan,1,"June 24, 2019",Monday,24,6,2019,2019,TV-PG,,2,1,"Anime Series, International TV Shows",2
80986854,TV Show,I Think You Should Leave with Tim Robinson,,,"Tim Robinson, Andy Samberg, Sam Richardson, Will Forte, Fred Willard, Cecily Strong, Tim Heidecker, Kate Berlant",8,United States,1,"April 23, 2019",Tuesday,23,4,2019,2019,TV-MA,,1,1,TV Comedies,1
80987077,TV Show,Signal,,,"Kim Hye-su, Lee Je-hoon, Cho Jin-woong, Jang Hyun-sung, Jeong Hae-gyoon, Kim Won-hae, Jung Han-bi, Lee Yu-jun, Son Hyeon-ju",9,South Korea,1,"October 1, 2019",Tuesday,1,10,2019,2016,TV-14,,1,1,"Crime TV Shows, International TV Shows, Korean TV Shows",3
80987113,TV Show,The Princess Weiyoung,,,"Tiffany Tang, Luo Jin, Vanness Wu, Rachel Momo, Hsin Ai Lee",5,China,1,"May 10, 2019",Friday,10,5,2019,2016,TV-14,,1,1,"International TV Shows, Romantic TV Shows, TV Dramas",3
80987209,TV Show,"Rica, Famosa, Latina",,,,,United States,1,"April 26, 2019",Friday,26,4,2019,2016,TV-14,,4,1,"International TV Shows, Reality TV, Spanish-Language TV Shows",3
80987458,TV Show,Special,,,"Ryan O'Connell, Jessica Hecht, Punam Patel, Marla Mindelle, Augustus Prew, Patrick Fabian",6,United States,1,"April 12, 2019",Friday,12,4,2019,2019,TV-MA,,1,1,TV Comedies,1
80987516,TV Show,Three Days of Christmas,,,"Victoria Abril, Elena Anaya, Mar Ayala, Nerea Barros, Berta Castañé, Verónica Echegui, Verónica Forqué, Ángela Molina, Anna Moliner, Charo López, Mariona Pagès, Carla Tous, Carles Arquimbau, Manel Barceló, Nausicaa Bonnín, Alicia Borrachero, Antonio Dechent, Miquel Fernández, Francesc Garrido, Iván Morales, Susi Sánchez, David Solans",22,Spain,1,"December 6, 2019",Friday,6,12,2019,2019,TV-MA,,1,1,"International TV Shows, Spanish-Language TV Shows, TV Dramas",3
80987753,TV Show,The Degenerates,,,"Big Jay Oakerson, Brad Williams, Yamaneika Saunders, Liza  Treyger, Joey Diaz, Christina Pazsitzky",6,,,"October 30, 2018",Tuesday,30,10,2018,2018,TV-MA,,1,1,"Stand-Up Comedy & Talk Shows, TV Comedies",2
80987906,TV Show,Yu-Gi-Oh! Arc-V,,,"Mike Liscio, Emily Bauer, Billy Bob Thompson, Alyson Leigh Rosenfeld, Michael Crouch",5,"Japan, Canada",2,"May 1, 2018",Tuesday,1,5,2018,2015,TV-Y7,,2,1,"Anime Series, Kids' TV",2
80988048,Movie,The Meaning of Monty Python,Albert Sharpe,1,,,United States,1,"October 2, 2018",Tuesday,2,10,2018,2013,TV-MA,60,0,0,Documentaries,1
80988062,Movie,Black Mirror: Bandersnatch,,,"Fionn Whitehead, Will Poulter, Craig Parkinson, Alice Lowe, Asim Chaudhry",5,United States,1,"December 28, 2018",Friday,28,12,2018,2018,TV-MA,312,0,0,"Dramas, International Movies, Sci-Fi & Fantasy",3
80988793,TV Show,Cooking on High,,,"Josh Leyva, Ngaio Bealum",2,United States,1,"June 22, 2018",Friday,22,6,2018,2018,TV-MA,,1,1,Reality TV,1
80988815,TV Show,Marching Orders,,,,,United States,1,"August 3, 2018",Friday,3,8,2018,2018,TV-14,,1,1,Docuseries,1
80988832,Movie,Sad Hill Unearthed,Guillermo de Oliveira,1,,,Spain,1,"December 15, 2018",Saturday,15,12,2018,2017,TV-14,83,0,0,"Documentaries, International Movies",2
80988860,TV Show,If I Hadn't Met You,,,"Pablo Derqui, Mercedes Sampietro, Andrea Ros, Javier Beltrán, Paula Malia, David Vert, Muguet Franc, Miquel García Borda, Berta Garcia, Joel Bramona, Montse Guallar, Abel Folk, Sergi López, Òscar Jarque, Eli Iranzo",15,Spain,1,"March 15, 2019",Friday,15,3,2019,2018,TV-MA,,1,1,"International TV Shows, Romantic TV Shows, TV Dramas",3
80989848,TV Show,Save Our Shelter,,,"Rocky Kanaka, Rob North",2,United States,1,"August 18, 2018",Saturday,18,8,2018,2015,TV-G,,1,1,Reality TV,1
80989867,TV Show,The Apartment,,,"Jamie Durie, Laurence Llewelyn-Bowen",2,Singapore,1,"December 14, 2018",Friday,14,12,2018,2014,TV-PG,,2,1,"International TV Shows, Reality TV",2
80989891,TV Show,Fit for Fashion,,,Louise Roe,1,,,"December 14, 2018",Friday,14,12,2018,2015,TV-14,,2,1,"International TV Shows, Reality TV",2
80989919,TV Show,Twice Upon A Time,,,"Gaspard Ulliel, Freya Mavor",2,France,1,"December 19, 2019",Thursday,19,12,2019,2019,TV-MA,,1,1,"International TV Shows, Romantic TV Shows, TV Dramas",3
80989924,TV Show,Greatest Events of WWII in Colour,,,,,United Kingdom,1,"November 8, 2019",Friday,8,11,2019,2019,TV-14,,1,1,"British TV Shows, Docuseries, International TV Shows",3
80990464,TV Show,忍者ハットリくん,,,,,Japan,1,"December 23, 2018",Sunday,23,12,2018,2012,TV-Y7,,2,1,"Anime Series, Kids' TV",2
80990571,TV Show,Blue Planet II,,,David Attenborough,1,United Kingdom,1,"December 3, 2018",Monday,3,12,2018,2017,TV-G,,1,1,"British TV Shows, Docuseries, Science & Nature TV",3
80990609,TV Show,The Neighbor,,,"Quim Gutiérrez, Clara Lago, Adrián Pino, Catelina Sopelana",4,Spain,1,"December 31, 2019",Tuesday,31,12,2019,2019,TV-MA,,1,1,"International TV Shows, Spanish-Language TV Shows, TV Comedies",3
80990612,TV Show,Sword Art Online Alternative: Gun Gale Online,,,"Tomori Kusunoki, Yoko Hikasa, Kazuyuki Okitsu, Chinatsu Akasaki",4,Japan,1,"February 1, 2019",Friday,1,2,2019,2018,TV-14,,1,1,"Anime Series, International TV Shows",2
80990849,TV Show,The Movies That Made Us,,,,,United States,1,"November 29, 2019",Friday,29,11,2019,2019,TV-MA,,1,1,Docuseries,1
80990935,TV Show,Something in the Rain,,,"Son Ye-jin, Jung Hae-in, Jang So-yeon",3,South Korea,1,"May 26, 2018",Saturday,26,5,2018,2018,TV-MA,,1,1,"International TV Shows, Korean TV Shows, Romantic TV Shows",3
80991025,Movie,Pacificum: Return to the Ocean,"Mariana Tschudi, Héctor Gálvez",2,,,Peru,1,"June 15, 2018",Friday,15,6,2018,2017,TV-G,74,0,0,"Documentaries, International Movies",2
80991060,TV Show,Flavorful Origins,,,Yang Chen,1,China,1,"October 30, 2019",Wednesday,30,10,2019,2019,TV-G,,2,1,"Docuseries, International TV Shows",2
80991329,TV Show,Larva Island,,,"Hong Bum-ki, Eddy Lee, Ahn Hyo-min, Kang Shi-hyun, Tom Wayland, Erica Schroeder",6,,,"March 1, 2019",Friday,1,3,2019,2019,TV-Y7,,2,1,"Kids' TV, Korean TV Shows, TV Comedies",3
80991872,TV Show,1994,Diego Enrique Osorno,1,,,Mexico,1,"May 17, 2019",Friday,17,5,2019,2019,TV-MA,,1,1,"Crime TV Shows, Docuseries, International TV Shows",3
80991879,TV Show,Examination of Conscience,,,,,Spain,1,"January 25, 2019",Friday,25,1,2019,2019,TV-MA,,1,1,"Crime TV Shows, Docuseries, International TV Shows",3
80992039,Movie,Two Catalonias,"Álvaro Longoria, Gerardo Olivares",2,,,Spain,1,"September 28, 2018",Friday,28,9,2018,2018,TV-MA,117,0,0,"Documentaries, International Movies",2
80992137,TV Show,CAROLE & TUESDAY,,,"Miyuri Shimabukuro, Kana Ichinose, Akio Otsuka, Miyu Irino, Sumire Uesaka, Hiroshi Kamiya, Mamoru Miyano, Kenyu Horiuchi, Tomoko Miyadera, Takahiro Sakurai, Maaya Sakamoto, Hiroki Yasumoto",12,Japan,1,"August 30, 2019",Friday,30,8,2019,2019,TV-MA,,1,1,"Anime Series, International TV Shows, Teen TV Shows",3
80992228,TV Show,KENGAN ASHURA,,,"Tatsuhisa Suzuki, Cho, Jouji Nakata, Yumi Uchiyama, Hayato Kaneko, Tetsu Inada, Yasuyuki Kase, Junya Enoki, Daisuke Namikawa, Ryuzo Hasuike",10,"United States, Japan",2,"October 31, 2019",Thursday,31,10,2019,2019,TV-MA,,2,1,"Anime Series, International TV Shows",2
80992231,Movie,Numero Zero. The Roots of Italian Rap,Enrico Bisi,1,,,Italy,1,"April 15, 2018",Sunday,15,4,2018,2015,TV-MA,91,0,0,"Documentaries, International Movies, Music & Musicals",3
80992500,Movie,Santo Cachón,,,,,Colombia,1,"October 26, 2018",Friday,26,10,2018,2018,TV-14,87,0,0,"Comedies, International Movies, Romantic Movies",3
80992787,TV Show,Revisions,,,"Koki Uchiyama, Mikako Komatsu, Nobunaga Shimazaki, Rie Takahashi, Manaka Iwami, Soma Saito",6,Japan,1,"May 14, 2019",Tuesday,14,5,2019,2018,TV-14,,1,1,"Anime Series, International TV Shows",2
80992853,TV Show,Ingress: The Animation,,,"Yoshiki Nakajima, Reina Ueda, Shigeo Kiyama, Tarusuke Shingaki, Kohsuke Toriumi, Kentaro Tone, Hiroo Sasaki, Megumi Ogata",8,Japan,1,"April 30, 2019",Tuesday,30,4,2019,2018,TV-MA,,1,1,"Anime Series, Crime TV Shows, International TV Shows",3
80992963,TV Show,The Story of Us with Morgan Freeman,,,Morgan Freeman,1,United States,1,"February 1, 2019",Friday,1,2,2019,2017,TV-14,,1,1,Docuseries,1
80993062,TV Show,The I-Land,,,"Natalie Martinez, Kate Bosworth, Ronald Peet, Kyle Schmid, Alex Pettyfer, Sibylla Deen, Gilles Geary, Anthony Lee Medina, Kota Eberhardt, Michelle Veintimilla, Bruce McGill",11,United States,1,"September 12, 2019",Thursday,12,9,2019,2019,TV-MA,,1,1,"TV Action & Adventure, TV Dramas, TV Sci-Fi & Fantasy",3
80993087,TV Show,Melodies of Life - Born This Way,,,,,,,"June 21, 2019",Friday,21,6,2019,2016,TV-14,,1,1,"International TV Shows, Romantic TV Shows, TV Comedies",3
80993088,TV Show,Love Rhythms - Accidental Daddy,,,Udom Taephanit,1,,,"June 18, 2018",Monday,18,6,2018,2016,TV-MA,,1,1,"International TV Shows, TV Comedies, TV Dramas",3
80993106,TV Show,The Underwear,,,"Thanabordee Jaiyen, Emika Grant Emma, Tantimedh Chisanusha, Siribanchawan Jidapa, Supanut Sudjinda",5,,,"June 19, 2018",Tuesday,19,6,2018,2017,TV-MA,,1,1,"International TV Shows, TV Dramas, Teen TV Shows",3
80993149,Movie,Maynard,Samuel D. Pollard,1,,,United States,1,"September 2, 2018",Sunday,2,9,2018,2017,TV-PG,100,0,0,Documentaries,1
80993613,TV Show,The Rise of Phoenixes,,,"Chen Kun, Ni Ni, Zhao Lixin, Ni Dahong, Yuan Hong, Wang Ou, Bai Jinting, Zhang Xiaochen, Mei Ting, Liu Mintao, Yu Mingjia, Hou Yansong, Hai Yitian, Shi An, Shao Tong",15,China,1,"September 14, 2018",Friday,14,9,2018,2018,TV-14,,1,1,"International TV Shows, Romantic TV Shows, TV Action & Adventure",3
80993625,TV Show,Oh My Ghost,,,"Nuengthida Sophon, Keerati Mahaprukpong, Arak Amornsupasiri, Malinee Adelaide Coates",4,Thailand,1,"November 21, 2018",Wednesday,21,11,2018,2018,TV-MA,,1,1,"International TV Shows, Romantic TV Shows, TV Comedies",3
80993627,TV Show,Unrequited Love,,,"Zhu Yanmanzi, Zhao Shunran, Shen Yu, Zhang Yichi, Mengqin, Esther Chen, Zhang Zhehao, He Meixuan, Yuan Baizihui",9,China,1,"July 17, 2019",Wednesday,17,7,2019,2019,TV-14,,1,1,"International TV Shows, Romantic TV Shows, TV Dramas",3
80993739,TV Show,Sotus The Series,,,"Sangpotirat Perawat, Ruangroj Prachaya",2,Thailand,1,"May 25, 2019",Saturday,25,5,2019,2016,TV-14,,1,1,"International TV Shows, Romantic TV Shows, TV Dramas",3
80993756,TV Show,Kiss The Series,,,"Lapassalal Jiravechsoontornkul, Mook Worranit Thawornwong, Jirakit Thawornwong, Sattaphong Phiangphor",4,,,"May 26, 2019",Sunday,26,5,2019,2016,TV-14,,1,1,"International TV Shows, Romantic TV Shows, TV Dramas",3
80993774,TV Show,Roonpi Secret Love,,,"Kanyawee Songmuang, Korapat Kirdpan",2,Thailand,1,"June 21, 2019",Friday,21,6,2019,2016,TV-PG,,3,1,"International TV Shows, Romantic TV Shows, Teen TV Shows",3
80993794,TV Show,แผนร้ายนายเจ้าเล่ห์,,,"Chutavuth Pattarakampol, Sheranut Yusananda, Nichaphat Chatchaipholrat, Thassapak Hsu",4,,,"March 30, 2019",Saturday,30,3,2019,2016,TV-14,,1,1,"International TV Shows, Romantic TV Shows, TV Comedies",3
80993816,TV Show,Ugly Duckling,,,"Mook Worranit Thawornwong, Puttichai Kasetsin, Natcha Juntapan, Neen Suwanamas, Esther Supreeleela, Shaun Jindachote, Lapassalal Jiravechsoontornkul, Chatchawit Techarukpong",8,Thailand,1,"February 15, 2019",Friday,15,2,2019,2015,TV-14,,4,1,"International TV Shows, Romantic TV Shows, TV Dramas",3
80994108,TV Show,Sisters,,,"Lucy Durack, Antonia Prebble, Maria Angelico, Dan Spielman, Charlie Garber, Lindsay Farris, Zindzi Okenyo, Catherine McClements, Roy Billing, Magda Szubanski",10,Australia,1,"September 1, 2018",Saturday,1,9,2018,2018,TV-MA,,1,1,"International TV Shows, TV Comedies, TV Dramas",3
80994222,TV Show,Historical Roasts,,,"Jeff Ross, Bob Saget, James Adomian, Rachel Feinstein, Jerry Minor, Ayden Mayeri, Jaleel White, Natasha Leggero, Yamaneika Saunders, John Stamos, Nikki Glaser, Seth Green, Fortune Feimster, Jon Lovitz, Mindy Rickles, Gilbert Gottfried, Sasheer Zamata, Brandon T. Jackson, Ryan Phillippe, Ken Marino, Bridget Everett, John Gemberling, Leonardo Nam, Josh Homme",24,United States,1,"May 27, 2019",Monday,27,5,2019,2019,TV-MA,,1,1,"Stand-Up Comedy & Talk Shows, TV Comedies",2
80994442,Movie,A new Capitalism,,,,,Brazil,1,"June 12, 2018",Tuesday,12,6,2018,2017,TV-PG,76,0,0,"Documentaries, International Movies",2
80994738,TV Show,ThirTEEN Terrors,,,"Thanapatpisal Sananthachat, Panisara Montharat, Sutatta Udomsilp, Teetatch Ratanasritai, Fame Chawin Likitjareonpong, Paladesh Kemisara, Thiti Mahayotaruk, Napat Chokejindachai, Um Apasiri Nitibhon, Skye Nateeton Wongrawee, Narikun Ketprapakorn, Sirinya Tantipongwatana, Chutavuth Pattarakampol, Thanyanan Pipatchaisiri, Sirachuch Chienthaworn, Jirayus Khawbaimai, Gunn Junhavat, Pavadee Komchokpaisan, Nichaphat Chatchaipholrat, Natthida Trichaiya, Kanyawee Songmuang, Claudine Craig, Sarit Trilertvichien, Teeradon Supapunpinyo, Narupornkamol Chaisang, Atthaphan Poonsawas, Oabnithi Wiwattanawarang",27,Thailand,1,"March 1, 2019",Friday,1,3,2019,2014,TV-MA,,1,1,"International TV Shows, TV Horror, TV Mysteries",3
80994754,TV Show,Project S The Series,,,"Wiwattanawarang Oabnithi, Mahayotaruk Thiti, Lerkcharoempoj Papangkorn, Imanothai Kawin, Sakuljaroensuk Apinya, Oat Pasakorn Sanrattana, Leeratanakajorn Thanapob, Skye Nateeton Wongrawee, Supapunpinyo Teeradon, Chansangavej Chayanit, Ketprapakorn Narikun, Pibunsonggram Kritsanapoom, Santinatornkul Chanon",13,Thailand,1,"October 19, 2018",Friday,19,10,2018,2017,TV-14,,4,1,"International TV Shows, TV Dramas, Teen TV Shows",3
80994807,Movie,Skydancers,Fredric Lean,1,,,"United States, France",2,"June 27, 2018",Wednesday,27,6,2018,2014,TV-G,49,0,0,"Documentaries, Sports Movies",2
80995039,TV Show,Ares,,,"Jade Olieberg, Tobias Kersloot, Lisa Smit, Frieda Barnhard, Hans Kesting, Rifka Lodeizen, Robin Boissevain, Jennifer Welts, Steef de Bot, Jip van den Dool, Janni Goslinga, Dennis Rudge, Ian Bok, Roos Dickmann, Minne Koole, Alexander Brouwer",16,,,"January 17, 2020",Friday,17,1,2020,2020,TV-MA,,1,1,"International TV Shows, TV Dramas, TV Horror",3
80995044,TV Show,Man vs Wild with Sunny Leone,,,"Bear Grylls, Sunny Leone",2,,,"December 1, 2018",Saturday,1,12,2018,2018,TV-PG,,1,1,"International TV Shows, Reality TV, TV Action & Adventure",3
80995073,TV Show,Queens vs. Kings,,,"Varun Thakur, Anu Menon, Rahul Subramanian, Siddharth Dudeja, Supriya Joshi, Utsav Chakraborty, Saadiya Ali, Kavya Bector, Kumar Varun",9,,,"October 25, 2018",Thursday,25,10,2018,2018,TV-14,,1,1,"Stand-Up Comedy & Talk Shows, TV Comedies",2
80995077,Movie,Little Singham aur Kaal ka Mahajaal,Prakash Satam,1,,,,,"December 1, 2018",Saturday,1,12,2018,2018,TV-Y7-FV,68,0,0,"Children & Family Movies, Comedies",2
80995078,Movie,Little Singham in London,Prakash Satam,1,,,,,"April 22, 2019",Monday,22,4,2019,2019,TV-Y7,66,0,0,"Children & Family Movies, Comedies",2
80995079,Movie,Little Singham Bandarpur Mein Hu Ha Hu,,,"Anamaya Verma, Ganesh Divekar, Jigna Bharadhwaj, Jitendra Dasadiva, Manoj Pandey, Manish Bhuvan, Meena Nahta, Neshma Chemburkar, Saumya Daan, Sonal Kaushal",10,,,"July 11, 2019",Thursday,11,7,2019,2019,TV-Y7,67,0,0,"Children & Family Movies, Comedies",2
80995081,Movie,Little Singham: Mahabali,Prakash Satam,1,"Saumya Daan, Sonal Kaushal, Anamaya Verma, Ganesh Divekar, Neshma Chemburkar",5,,,"November 27, 2019",Wednesday,27,11,2019,2019,TV-Y7,69,0,0,"Children & Family Movies, Comedies",2
80995575,Movie,The Birth Reborn,Eduardo Chauvet,1,,,Brazil,1,"August 10, 2018",Friday,10,8,2018,2013,TV-14,91,0,0,"Documentaries, International Movies",2
80995576,Movie,The Birth Reborn,Eduardo Chauvet,1,,,,,"October 1, 2018",Monday,1,10,2018,2018,TV-MA,91,0,0,"Documentaries, International Movies",2
80995577,Movie,The Birth Reborn 3,Eduardo Chauvet,1,,,Brazil,1,"December 28, 2018",Friday,28,12,2018,2018,TV-MA,73,0,0,"Documentaries, International Movies",2
80995687,Movie,Little Singham: Kaal Ki Tabaahi,Prakash Satam,1,,,,,"October 19, 2019",Saturday,19,10,2019,2019,TV-Y7,66,0,0,"Children & Family Movies, Comedies",2
80995991,Movie,Vir Das: Losing It,Marcus Raboy,1,Vir Das,1,,,"December 11, 2018",Tuesday,11,12,2018,2018,TV-MA,68,0,0,Stand-Up Comedy,1
80996338,TV Show,Typewriter,,,"Aarna Sharma, Aaryansh Malviya, Mikail Gandhi, Palash Kamble, Jishu Sengupta, Palomi Ghosh, Purab Kohli, Sameer Kochhar, Sara Gesawat",9,India,1,"July 19, 2019",Friday,19,7,2019,2019,TV-MA,,1,1,"International TV Shows, TV Horror, TV Mysteries",3
80996343,Movie,Our Shining Days,,,"Lulu Xu, Yuchang Peng, Mingjie Luo, Yongxi Liu, Zhongyu Han, Zhaohua Lu",6,China,1,"July 1, 2018",Sunday,1,7,2018,2017,TV-PG,103,0,0,"Comedies, Dramas, International Movies",3
80996455,TV Show,Borges,,,"Thati Lopes, Antonio Pedro Tabet, Karina Ramil, Rafael Portugal, Luis Lobianco",5,Brazil,1,"June 25, 2018",Monday,25,6,2018,2018,TV-MA,,1,1,"International TV Shows, TV Comedies",2
80996626,TV Show,Dance & Sing with True,,,"Michela Luci, Jamie Watson, Anna Claire Bartlam, Dante Zee, Eric Peterson",5,,,"May 18, 2018",Friday,18,5,2018,2018,TV-Y,,1,1,Kids' TV,1
