show_id,type,title,director,director_num,cast,cast_num,country,country_num,date_added,weekday_added,day_added,month_added,year_added,release_year,rating,duration,season,serial,listed_in,listed_in_num
80183051,TV Show,7SEEDS,,,"Nao Toyama, Jun Fukuyama, Katsuyuki Konishi, Yoko Soumi, Kana Asumi, Akira Ishida, Aoi Yuki, Kazuhiko Inoue, Yoko Hikasa, Hirofumi Nojima, Ryotaro Okiayu, Eri Kitamura, Mamiko Noto, Ryo Hirohashi, Shizuka Ito, Hisao Egawa, Mayumi Asano, Kenta Miyake, Ai Kakuma, Kaito Ishikawa, Mikako Komatsu, Daisuke Sakaguchi, Takanori Hoshino, Kenjiro Tsuda, Nozomu Sasaki, Kenji Nojima, Houko Kuwashima, Kensho Ono, Takahiro Sakurai, Haruka Chisuga, Yu Shimamura, Takuma Terashima, Takuya Sato, Junko Minagawa, Masashi Sugawara, Sho Hayami, Kazuyuki Okitsu, Minako Kotobuki",38,,,"June 28, 2019",Friday,28,6,2019,2019,TV-MA,,1,1,"Anime Series, International TV Shows",2
80183089,Movie,Mau Nieto: Viviendo sobrio… desde el bar,,,Mau Nieto,1,Mexico,1,"January 26, 2018",Friday,26,1,2018,2018,TV-MA,57,0,0,Stand-Up Comedy,1
80183199,TV Show,Seven and Me,,,"Leila Jolene, Flavio Parenti, Josefin Asplund",3,France,1,"October 15, 2017",Sunday,15,10,2017,2017,TV-G,,1,1,Kids' TV,1
80183783,Movie,Let It Fall: Los Angeles 1982-1992,John Ridley,1,,,United States,1,"November 6, 2017",Monday,6,11,2017,2017,TV-MA,144,0,0,Documentaries,1
80183878,TV Show,Let's Eat 2,,,"Yoon Du-jun, Seo Hyun-jin, Kwon Yul, Kim Hee-won, Hwang Seog-jeong, Cho Eun-ji, Hwang Seung-un, Lee Ju-seung, Kim Ji-young",9,"Malaysia, Singapore, Hong Kong",3,"August 8, 2019",Thursday,8,8,2019,2015,TV-14,,1,1,"International TV Shows, Korean TV Shows, Romantic TV Shows",3
80184055,Movie,Resurface,"Josh Izenberg, Wynn Padula",2,,,United States,1,"September 1, 2017",Friday,1,9,2017,2017,TV-MA,28,0,0,"Documentaries, Sports Movies",2
80184067,TV Show,Amazing Interiors,,,,,United Kingdom,1,"July 20, 2018",Friday,20,7,2018,2018,TV-PG,,1,1,"British TV Shows, International TV Shows, Reality TV",3
80184068,TV Show,Requiem,,,"Lydia Wilson, Joel Fry, Brendan Coyle, James Frecheville, Claire Rushbrook, Joanna Scanlan, Pippa Haywood, Tara Fitzgerald, Richard Harrington, Sian Reese-Williams",10,United Kingdom,1,"March 23, 2018",Friday,23,3,2018,2018,TV-MA,,1,1,"British TV Shows, International TV Shows, TV Dramas",3
80184131,Movie,LA 92,"Daniel Lindsay, T.J. Martin",2,,,United States,1,"March 1, 2018",Thursday,1,3,2018,2017,R,114,0,0,Documentaries,1
80184154,TV Show,Kon Kon Kon,,,,,,,"February 16, 2018",Friday,16,2,2018,2014,TV-PG,,1,1,"Docuseries, International TV Shows",2
80184208,TV Show,Timeline,,,"Santiwithi Phrombut, Jamorn Kijsawapak, Orrawan Phuakthaisong",3,,,"February 23, 2018",Friday,23,2,2018,2014,TV-14,,1,1,"Crime TV Shows, Docuseries, International TV Shows",3
80184358,TV Show,Lovesick,,,"Kongyingyong Chonlathorn, Phumphothingam Nawat, Luangsodsai Anupart, Nuchanart Veerakaarn, Chindavanich Primrose, Charnmanoon Pannin, Nungira Hanwutinanon, Ausavaterakul Ausavapat, Sirikiet Saejea, Nontapan Chuenwarin",10,,,"September 3, 2018",Monday,3,9,2018,2014,TV-14,,1,1,"International TV Shows, Romantic TV Shows, TV Dramas",3
80184379,TV Show,The Who Was? Show,,,"Haley Tju, Adam Hochstetter, Kirrilee Berger, Lilla Crawford, Bentley Green, Zach Timson, Andrew Daly, H. Jon Benjamin",8,United States,1,"May 11, 2018",Friday,11,5,2018,2018,TV-Y7,,1,1,"Kids' TV, TV Comedies",2
80184405,TV Show,The Innocents,,,"Sorcha Groundsell, Percelle Ascott, Guy Pearce, Sam Hazeldine, Nadine Marshall, Jóhannes Haukur Jóhannesson, Laura Birn, Ingunn Beate Øyen, Arthur Hughes, Trond Fausa, Lise Risom Olsen, Philip Wright",12,United Kingdom,1,"August 24, 2018",Friday,24,8,2018,2018,TV-MA,,1,1,"British TV Shows, International TV Shows, Romantic TV Shows",3
80184422,TV Show,Ha Unlimited,,,"Tuck Boriboon, Ball Chernyim, Na’Kom Chuanchuen",3,,,"May 11, 2018",Friday,11,5,2018,2016,TV-14,,2,1,"International TV Shows, TV Comedies",2
80184569,TV Show,The Day I Met El Chapo,,,Kate del Castillo,1,United States,1,"October 20, 2017",Friday,20,10,2017,2017,TV-MA,,1,1,"Crime TV Shows, Docuseries, International TV Shows",3
80184595,TV Show,Life Plan A and B,,,"Rainie Yang, Yan Yu-lin, Johnny Lu, Chang Fu-chien, Chen Chi-hsia",5,Taiwan,1,"August 1, 2017",Tuesday,1,8,2017,2016,TV-PG,,1,1,"International TV Shows, Romantic TV Shows, TV Dramas",3
80184682,TV Show,The New Legends of Monkey,,,"Chai Hansen, Luciane Buchanan, Josh Thomson, Emilie Cocquerel, Josh McKenzie, Jordan Mooney, Jarred Blakiston",7,"Australia, New Zealand",2,"April 27, 2018",Friday,27,4,2018,2018,TV-PG,,1,1,"Kids' TV, TV Action & Adventure, TV Sci-Fi & Fantasy",3
80184684,TV Show,Love Storm,,,"Chris Wu, Chen Yu, Greg Han, Esther Yeh, Yeh Chen-Ting, Deng Yu-kai",6,,,"August 1, 2017",Tuesday,1,8,2017,2016,TV-PG,,1,1,"International TV Shows, Romantic TV Shows, TV Comedies",3
80184771,TV Show,Inside Bill's Brain: Decoding Bill Gates,,,Bill Gates,1,United States,1,"September 20, 2019",Friday,20,9,2019,2019,TV-14,,1,1,"Docuseries, Science & Nature TV",2
80184974,Movie,Concrete Football,"Jesse Adang, Syrine Boulanouar",2,,,"Czech Republic, France",2,"September 1, 2017",Friday,1,9,2017,2016,TV-MA,52,0,0,"Documentaries, International Movies, Sports Movies",3
80185003,TV Show,P. King Duckling,,,"Marc Thompson, Benjie Randall, Courtney Shaw",3,United States,1,"November 7, 2017",Tuesday,7,11,2017,2016,TV-Y,,1,1,"Kids' TV, TV Comedies",2
80185048,TV Show,Terrorism Close Calls,,,,,"United States, Czech Republic",2,"October 26, 2018",Friday,26,10,2018,2018,TV-MA,,1,1,"Crime TV Shows, Docuseries, International TV Shows",3
80185065,TV Show,Inside the Criminal Mind,,,,,"United States, Czech Republic",2,"August 31, 2018",Friday,31,8,2018,2018,TV-MA,,1,1,"Crime TV Shows, Docuseries, International TV Shows",3
80185070,Movie,Father of the Year,,,"David Spade, Nat Faxon, Joey Bragg, Matt Shively, Bridgit Mendler, Jackie Sandler, Mary Gillis",7,United States,1,"July 20, 2018",Friday,20,7,2018,2018,TV-14,95,0,0,Comedies,1
80185074,TV Show,Splash and Bubbles,,,"John Tartaglia, Leslie Carrara-Rudolph, Raymond Carr, Aymee Garcia",4,United States,1,"August 13, 2018",Monday,13,8,2018,2018,TV-Y,,2,1,Kids' TV,1
80185145,TV Show,Fate/EXTRA Last Encore,,,"Atsushi Abe, Sakura Tange, Kana Ueda, Hiroshi Kamiya, Noriko Shitaya, Kohsuke Toriumi, Urara Takano, Ai Nonaka, Kunihiko Yasui, Takahiro Mizushima",10,Japan,1,"October 30, 2018",Tuesday,30,10,2018,2018,TV-MA,,2,1,"Anime Series, International TV Shows",2
80185171,TV Show,Collateral,,,"Carey Mulligan, John Simm, Nicola Walker, Billie Piper, Nathaniel Martello-White, Jeany Spark, Hayley Squires, Ben Miles, Saskia Reeves, Ahd",10,"United Kingdom, United States",2,"March 9, 2018",Friday,9,3,2018,2018,TV-MA,,1,1,"British TV Shows, Crime TV Shows, International TV Shows",3
80185178,TV Show,Girls Incarcerated,,,,,United States,1,"June 21, 2019",Friday,21,6,2019,2019,TV-MA,,2,1,"Docuseries, Reality TV",2
80185266,TV Show,Heavy Rescue: 401,,,Dave Pettitt,1,Canada,1,"June 22, 2018",Friday,22,6,2018,2018,TV-MA,,2,1,"International TV Shows, Reality TV",2
80185369,TV Show,Close Your Eyes Before It’s Dark,,,"Bryan Shu-Hao Chang, Jian Man-shu, Yen Tsao, Sun Ke-fang, Allen Chen, Jake Hsu, Chu Sheng-ping, Blue Lan",8,Taiwan,1,"August 1, 2017",Tuesday,1,8,2017,2016,TV-14,,1,1,"Crime TV Shows, International TV Shows, TV Dramas",3
80185427,TV Show,"Have You Ever Fallen in Love, Miss Jiang?",,,"Lan Cheng-lung, Esther Yeh, He Yu-chen, Greg Han",4,,,"August 1, 2017",Tuesday,1,8,2017,2016,TV-MA,,1,1,"Crime TV Shows, International TV Shows, TV Dramas",3
80185622,TV Show,Nurses Who Kill,,,,,United Kingdom,1,"August 1, 2017",Tuesday,1,8,2017,2016,TV-14,,1,1,"British TV Shows, Crime TV Shows, Docuseries",3
80185707,TV Show,Everyday Miracles,,,Mark Miodownik,1,United Kingdom,1,"August 1, 2017",Tuesday,1,8,2017,2014,TV-PG,,1,1,"British TV Shows, Docuseries, International TV Shows",3
80185722,Movie,The Women Who Kill Lions,Neil Rawles,1,,,United Kingdom,1,"August 1, 2017",Tuesday,1,8,2017,2016,TV-MA,47,0,0,"Documentaries, International Movies",2
80185723,Movie,Cop Watchers,Ben Steele,1,,,,,"August 1, 2017",Tuesday,1,8,2017,2016,TV-MA,45,0,0,"Documentaries, International Movies",2
80185801,TV Show,Genius of the Ancient World,,,Bettany Hughes,1,United Kingdom,1,"August 1, 2017",Tuesday,1,8,2017,2015,TV-PG,,1,1,"British TV Shows, Docuseries, International TV Shows",3
80185803,TV Show,Aussie Gold Hunters,,,,,Australia,1,"August 1, 2017",Tuesday,1,8,2017,2016,TV-MA,,1,1,"Docuseries, International TV Shows, Reality TV",3
80186090,TV Show,The Big Family Cooking Showdown,,,"Zoe Ball, Nadiya Hussain, Giorgio Locatelli, Rosemary Shrager",4,United Kingdom,1,"February 22, 2019",Friday,22,2,2019,2018,TV-PG,,2,1,"British TV Shows, International TV Shows, Reality TV",3
80186252,TV Show,Genius of the Modern World,,,Bettany Hughes,1,United Kingdom,1,"August 1, 2017",Tuesday,1,8,2017,2016,TV-14,,1,1,"British TV Shows, Docuseries, International TV Shows",3
80186459,TV Show,The Frozen Dead,,,"Charles Berling, Julia Piaton, Pascal Greggory, Nina Meurisse, Lubna Azabal, Anne Le Ny, Robinson Stévenin, Robert Plagnol, Sophie Guillemin",9,France,1,"January 1, 2018",Monday,1,1,2018,2017,TV-MA,,1,1,"Crime TV Shows, International TV Shows, TV Dramas",3
80186475,TV Show,Pokémon the Series,,,"Sarah Natochenny, Laurie Hymes, Jessica Paquet, Rosie Reyes, Alyson Leigh Rosenfeld, Marc Swint, Rodger Parsons",7,Japan,1,"April 1, 2019",Monday,1,4,2019,2019,TV-Y7-FV,,2,1,"Anime Series, Kids' TV",2
80186731,Movie,Gender Revolution: A Journey with Katie Couric,,,Katie Couric,1,United States,1,"February 1, 2018",Thursday,1,2,2018,2017,TV-PG,90,0,0,"Documentaries, LGBTQ Movies",2
80186848,TV Show,Jack Whitehall: Travels with My Father,,,"Jack Whitehall, Michael Whitehall",2,United Kingdom,1,"September 6, 2019",Friday,6,9,2019,2019,TV-MA,,3,1,"British TV Shows, Docuseries, International TV Shows",3
80186862,Movie,Michael Lost and Found,Daniel Wilner,1,,,"Canada, United States",2,"June 1, 2017",Thursday,1,6,2017,2017,TV-PG,19,0,0,"Documentaries, International Movies, LGBTQ Movies",3
80186863,TV Show,The Umbrella Academy,,,,,United States,1,"February 15, 2019",Friday,15,2,2019,2019,TV-14,,1,1,"TV Action & Adventure, TV Mysteries, TV Sci-Fi & Fantasy",3
80186926,TV Show,​SAINT SEIYA: Knights of the Zodiac,,,"Bryson Baugus, Emily Neves, Blake Shepard, Patrick Poole, Luci Christian, Adam Gibbs, Masakazu Morita, Fumiko Orikasa, Takahiro Sakurai, Hiroaki Miura, Satomi Sato, Katsuyuki Konishi",12,Japan,1,"July 19, 2019",Friday,19,7,2019,2019,TV-14,,1,1,"Anime Series, International TV Shows",2
80187030,TV Show,The Innocent Man,,,John Grisham,1,United States,1,"December 14, 2018",Friday,14,12,2018,2018,TV-MA,,1,1,"Crime TV Shows, Docuseries",2
80187052,TV Show,Time: The Kalief Browder Story,,,,,United States,1,"April 7, 2019",Sunday,7,4,2019,2017,TV-MA,,1,1,Docuseries,1
80187223,TV Show,PJ Masks,,,"Jacob Ewaniuk, Kyle Breitkopf, Addison Holley",3,"France, United Kingdom",2,"October 1, 2017",Sunday,1,10,2017,2016,TV-Y,,1,1,Kids' TV,1
80187302,TV Show,Stranger,,,"Seung-woo Cho, Doona Bae, Joon-hyuk Lee, Kyeong-yeong Lee, Jae-myung Yoo, Hye-sun Shin",6,South Korea,1,"November 1, 2017",Wednesday,1,11,2017,2017,TV-MA,,1,1,"Crime TV Shows, International TV Shows, Korean TV Shows",3
80187306,Movie,RUSSELL BRAND: RE:BIRTH,Chris Howe,1,Russell Brand,1,,,"December 4, 2018",Tuesday,4,12,2018,2018,TV-MA,63,0,0,Stand-Up Comedy,1
80187722,TV Show,FIGHTWORLD,Padraic McKinley,1,Frank Grillo,1,,,"October 12, 2018",Friday,12,10,2018,2018,TV-MA,,1,1,Docuseries,1
80188051,TV Show,Larry Charles' Dangerous World of Comedy,,,Larry Charles,1,,,"February 15, 2019",Friday,15,2,2019,2019,TV-MA,,1,1,"Docuseries, TV Comedies",2
80188351,TV Show,Reply 1988,,,"Lee Hye-ri, Park Bo-gum, Ryu Jun-yeol, Ko Kyoung-pyo, Lee Dong-hwi, Ryu Hye-young, Sung Dong-il, Lee Il-hwa",8,,,"January 1, 2020",Wednesday,1,1,2020,2015,TV-14,,1,1,"International TV Shows, Korean TV Shows, Romantic TV Shows",3
80188605,TV Show,Cinderella and the Four Knights,,,"Jung Il-woo, Ahn Jae-hyeon, Park So-dam, Lee Jung-shin, Kim Yong-geon, Choi Min, Son Na-eun",7,,,"December 15, 2019",Sunday,15,12,2019,2016,TV-14,,1,1,"International TV Shows, Korean TV Shows, Romantic TV Shows",3
80188730,TV Show,The K2,,,"Ji Chang-wook, Song Yoon-a, Lim Yoona, Cho Seong-ha, Kim Kap-soo, Lee Jung-jin, Son Tae-young, Shin Dong-mi",8,South Korea,1,"October 1, 2019",Tuesday,1,10,2019,2016,TV-14,,1,1,"International TV Shows, Korean TV Shows, Romantic TV Shows",3
80188823,Movie,Iron Fists and Kung-Fu Kicks,Serge Ou,1,,,Australia,1,"December 1, 2019",Sunday,1,12,2019,2019,TV-MA,108,0,0,"Documentaries, International Movies",2
80188935,TV Show,A Thousand Goodnights,,,"Cindy Lien, Nicholas Teo, Yao Ai-ning, Li Chung-lin, Chen Bor-jeng, Miao Ke-li",6,Taiwan,1,"June 1, 2019",Saturday,1,6,2019,2019,TV-14,,1,1,"International TV Shows, TV Dramas",2
80188953,TV Show,Afflicted,,,,,United States,1,"August 10, 2018",Friday,10,8,2018,2018,TV-MA,,1,1,"Docuseries, Reality TV",2
80188969,TV Show,A Boy Name Flora A,,,"Crowd Lu, Tsai Chen-nan, Lotus Wang, Fan Chu-Mei, Hsieh Ying-shiuan, Vera Yen, Cammy Chiang",7,Taiwan,1,"September 1, 2017",Friday,1,9,2017,2017,TV-MA,,1,1,"International TV Shows, TV Comedies, TV Dramas",3
80189155,TV Show,A House of Blocks,,,"Eli Shi, Phoebe Lin, Chen Wan-ting, Fan Chen-fei, Lu Hsueh-feng, Figaro Tseng, Winnie Chang, Elten Ting",8,,,"September 1, 2017",Friday,1,9,2017,2017,TV-MA,,1,1,"International TV Shows, TV Dramas, TV Horror",3
80189183,TV Show,Mobile Suit Gundam UC,,,"Kouki Uchiyama, Ayumi Fujimura, Hiro Shimono, Haruka Tomatsu, Daisuke Namikawa, Megumi Toyoguchi, Yuhko Kaida, Shuichi Ikeda, Tetsuya Kakihara",9,Japan,1,"September 20, 2018",Thursday,20,9,2018,2014,TV-14,,1,1,"Anime Series, International TV Shows",2
80189208,TV Show,All About Love,,,"Christina Mok, River Huang, Stone Yang, April Liu, Andy Wu, Jake Hsu",6,Taiwan,1,"September 1, 2017",Friday,1,9,2017,2017,TV-14,,1,1,"International TV Shows, TV Dramas, TV Horror",3
80189209,TV Show,What She Put on the Table,,,"Amber An, Sun Ke-fang, Chang Yao-jen, Wang Man-chiao, Hans Chung, Chris Lee, Yan Yu-lin, Kiki Chen, Steven Chiang",9,Taiwan,1,"October 1, 2017",Sunday,1,10,2017,2017,TV-PG,,1,1,"International TV Shows, TV Dramas",2
80189221,TV Show,The Haunting of Hill House,,,"Michiel Huisman, Carla Gugino, Timothy Hutton, Henry Thomas, Elizabeth Reaser, Oliver Jackson-Cohen, Kate Siegel, Victoria Pedretti, Lulu Wilson, Mckenna Grace, Paxton Singleton, Julian Hilliard, Violet McGraw",13,United States,1,"October 12, 2018",Friday,12,10,2018,2018,TV-MA,,1,1,"TV Dramas, TV Horror, TV Mysteries",3
80189451,TV Show,Inside the Mind of a Serial Killer,,,,,United States,1,"July 1, 2019",Monday,1,7,2019,2015,TV-14,,1,1,"Crime TV Shows, Docuseries",2
80189522,TV Show,Dogs of Berlin,,,"Felix Kramer, Fahri Yardim, Anna Maria Mühe, Katharina Schüttler, Alina Stiegler, Urs Rechn, Sinan Farhangmehr, Kais Setti, Mohamed Issa, Hauke Diekamp, David Bennent, Deniz Orta, Katrin Saß, Sebastian Zimmler",14,Germany,1,"December 7, 2018",Friday,7,12,2018,2018,TV-MA,,1,1,"Crime TV Shows, International TV Shows, TV Dramas",3
80189586,TV Show,If I were an Animal,,,"Zachary Young, Fleur Delahunty",2,,,"September 11, 2018",Tuesday,11,9,2018,2018,TV-Y,,1,1,"Docuseries, Kids' TV, Science & Nature TV",3
80189619,TV Show,A Taiwanese Tale of Two Cities,,,"Tammy Chen, James Wen, Peggy Tseng, Denny Huang",4,,,"January 27, 2019",Sunday,27,1,2019,2018,TV-MA,,1,1,"International TV Shows, TV Dramas",2
80189623,Movie,The Death and Life of Marsha P. Johnson,David France,1,,,United States,1,"October 6, 2017",Friday,6,10,2017,2017,TV-MA,106,0,0,"Documentaries, LGBTQ Movies",2
80189632,TV Show,Charlie's Colorforms City,,,"Jacob Soley, Saara Chaudry, Tyler Barish, Zoe Hatz, Julie Lemieux, Joseph Motiki, Shoshana Sperling, Adrianna Di Liello, Deann Degruijter, Stacey DePass",10,United States,1,"March 22, 2019",Friday,22,3,2019,2019,TV-Y,,1,1,Kids' TV,1
80189648,TV Show,Hyperdrive,,,"Rutledge Wood, Mike Hill, Michael Bisping, Lindsay Czarniak",4,United States,1,"August 21, 2019",Wednesday,21,8,2019,2019,TV-PG,,1,1,Reality TV,1
80189656,TV Show,Paprika,,,"Kaycie Chase, David Gasman, Tom Morton, Lee Delong, Barbara Weber-Scaff",5,,,"January 31, 2019",Thursday,31,1,2019,2018,TV-Y,,1,1,Kids' TV,1
80189685,TV Show,The Witcher,,,"Henry Cavill, Anya Chalotra, Freya Allan, Jodhi May, MyAnna Buring, Joey Batey, Eamon Farren, Mimi Ndiweni, Björn Hlynur Haraldsson, Adam Levy, Lars Mikkelsen, Royce Pierreson, Wilson Radjou-Pujalte, Anna Shaffer",14,"Poland, United States",2,"December 20, 2019",Friday,20,12,2019,2019,TV-MA,,1,1,"TV Action & Adventure, TV Dramas, TV Mysteries",3
80189791,TV Show,Dark Tourist,,,,,New Zealand,1,"July 20, 2018",Friday,20,7,2018,2018,TV-MA,,1,1,"Docuseries, International TV Shows",2
80189829,TV Show,The Protector,,,"Çağatay Ulusoy, Ayça Ayşin Turan, Hazar Ergüçlü, Okan Yalabık, Mehmet Kurtuluş, Yurdaer Okur",6,Turkey,1,"April 26, 2019",Friday,26,4,2019,2019,TV-MA,,2,1,"International TV Shows, Romantic TV Shows, TV Action & Adventure",3
80189898,TV Show,Osmosis,,,"Agathe Bonitzer, Hugo Becker, Gaël Kamilindi, Manoël Dupont, Stéphane Pitti, Luna Silva, Yuming Hey, Suzanne Rault-Balet, Philypa Phoenix, Lena Lapres, Waly Dia, Aurélia Petit, Lionel Lingelser, Fabien Ducommun",14,France,1,"March 29, 2019",Friday,29,3,2019,2019,TV-MA,,1,1,"International TV Shows, TV Dramas, TV Mysteries",3
80190009,TV Show,Fastest Car,,,,,United States,1,"September 20, 2019",Friday,20,9,2019,2019,TV-MA,,2,1,Reality TV,1
80190086,TV Show,The Hook Up Plan,,,"Marc Ruchmann, Zita Hanrot, Sabrina Ouazani, Joséphine Drai, Syrus Shahidi, Yvan Naubron, Guillaume Labbé, Tom Dingler",8,France,1,"October 11, 2019",Friday,11,10,2019,2019,TV-14,,2,1,"International TV Shows, Romantic TV Shows, TV Comedies",3
80190097,TV Show,November 13: Attack on Paris,,,,,France,1,"June 1, 2018",Friday,1,6,2018,2018,TV-MA,,1,1,"Docuseries, International TV Shows",2
80190144,Movie,The House on Coco Road,Damani Baker,1,,,United States,1,"June 30, 2017",Friday,30,6,2017,2016,TV-14,79,0,0,Documentaries,1
80190279,TV Show,The Indian Detective,,,"Russell Peters, Anupam Kher, Christina Cole, Mishqah Parthiephal, Hamza Haq, Meren Reddy, William Shatner",7,"Canada, Germany, South Africa",3,"December 19, 2017",Tuesday,19,12,2017,2017,TV-14,,1,1,"Crime TV Shows, International TV Shows, TV Comedies",3
80190407,TV Show,Murderous Affairs,,,,,United States,1,"April 17, 2018",Tuesday,17,4,2018,2017,TV-14,,3,1,"Crime TV Shows, Docuseries",2
80190510,TV Show,Magic for Humans,,,Justin Willman,1,United States,1,"August 17, 2018",Friday,17,8,2018,2018,TV-14,,1,1,"Reality TV, TV Comedies",2
80190518,TV Show,Sudden,,,"Rui En, Romeo Tan, Rebecca Lim, Zhang Zhenhuan",4,,,"October 1, 2017",Sunday,1,10,2017,2013,TV-14,,1,1,"International TV Shows, Romantic TV Shows, TV Dramas",3
80190519,TV Show,Giri / Haji,,,"Takehiro Hira, Kelly Macdonald, Yosuke Kubozuka, Will Sharpe, Aoi Okuyama, Masahiro Motoki, Yuko Nakamura, Mitsuko Oka, Anna Sawai, Charlie Creed-Miles",10,United Kingdom,1,"January 10, 2020",Friday,10,1,2020,2019,TV-MA,,1,1,"British TV Shows, Crime TV Shows, International TV Shows",3
80190535,Movie,The Edge of Democracy,Petra Costa,1,,,Brazil,1,"June 19, 2019",Wednesday,19,6,2019,2019,TV-14,122,0,0,"Documentaries, International Movies",2
80190585,Movie,Blurred Lines: Inside the Art World,Barry Avrich,1,,,Canada,1,"December 31, 2017",Sunday,31,12,2017,2017,TV-MA,85,0,0,Documentaries,1
80190840,Movie,A Gray State,Erik Nelson,1,,,United States,1,"December 25, 2017",Monday,25,12,2017,2017,TV-MA,93,0,0,Documentaries,1
80190843,TV Show,First and Last,,,,,,,"September 7, 2018",Friday,7,9,2018,2018,TV-MA,,1,1,Docuseries,1
80190844,Movie,AlphaGo,Greg Kohs,1,,,United States,1,"January 1, 2018",Monday,1,1,2018,2017,TV-G,90,0,0,Documentaries,1
80191000,TV Show,The Most Beautiful Hands of Delhi,,,"Björn Kjellman, Joy Sengupta, Natasha Jayetileke",3,Sweden,1,"July 20, 2017",Thursday,20,7,2017,2017,TV-MA,,1,1,"International TV Shows, TV Comedies, TV Dramas",3
80191036,TV Show,Dogs,,,,,United States,1,"November 16, 2018",Friday,16,11,2018,2018,TV-PG,,1,1,Docuseries,1
80191044,Movie,ReMastered: Who Killed Jam Master Jay?,Brian Oakes,1,,,,,"December 7, 2018",Friday,7,12,2018,2018,TV-MA,59,0,0,"Documentaries, Music & Musicals",2
80191046,Movie,ReMastered: The Miami Showband Massacre,Stuart Sender,1,,,,,"March 22, 2019",Friday,22,3,2019,2019,TV-MA,71,0,0,"Documentaries, Music & Musicals",2
80191047,Movie,ReMastered: Who Shot the Sheriff,Kief Davidson,1,,,United States,1,"October 12, 2018",Friday,12,10,2018,2018,TV-14,57,0,0,"Documentaries, Music & Musicals",2
80191048,Movie,ReMastered: Massacre at the Stadium,Bent-Jorgen Perlmutt,1,,,,,"January 11, 2019",Friday,11,1,2019,2019,TV-MA,65,0,0,"Documentaries, Music & Musicals",2
80191049,Movie,ReMastered: Devil at the Crossroads,Brian Oakes,1,,,United States,1,"April 26, 2019",Friday,26,4,2019,2019,TV-14,49,0,0,"Documentaries, Music & Musicals",2
80191050,Movie,ReMastered: The Lion's Share,Sam Cullman,1,,,,,"May 17, 2019",Friday,17,5,2019,2019,TV-14,84,0,0,"Documentaries, Music & Musicals",2
80191051,Movie,ReMastered: Tricky Dick & The Man in Black,Sara Dosa,1,,,United States,1,"November 2, 2018",Friday,2,11,2018,2018,TV-MA,59,0,0,"Documentaries, Music & Musicals",2
80191074,TV Show,Death by Magic,,,Drummond Money-Coutts,1,United States,1,"November 30, 2018",Friday,30,11,2018,2018,TV-14,,1,1,Reality TV,1
80191075,TV Show,Equestria Girls: Tales of Canterlot High,,,"Tara Strong, Ashleigh Ball, Andrea Libman, Tabitha St. Germain, Cathy Weseluck, Rebecca Shoichet, Andrew Toth, Ali Liebert",8,"United States, Canada",2,"October 1, 2017",Sunday,1,10,2017,2017,TV-Y,,1,1,"Kids' TV, TV Comedies",2
80191081,Movie,DreamWorks Home: For the Holidays,,,"Rachel Crow, Mark Whitten, Kelly Clarkson, Ana Ortiz, Ben Schwartz, Ron Funches, Matt Jones",7,United States,1,"December 1, 2017",Friday,1,12,2017,2017,TV-Y7,46,0,0,"Children & Family Movies, Comedies, Music & Musicals",3
80191236,TV Show,Luis Miguel - The Series,,,"Diego Boneta, Juan Pablo Zurita, Camila Sodi, Óscar Jaenada, Izan Llunas, Paulina Dávila, Martín Bello, Anna Favella, César Bordón, Vanessa Bauche",10,Mexico,1,"July 12, 2019",Friday,12,7,2019,2018,TV-MA,,1,1,"International TV Shows, Spanish-Language TV Shows, TV Dramas",3
80191239,TV Show,Tidelands,,,"Charlotte Best, Elsa Pataky, Marco Pigossi, Aaron Jakubenko, Mattias Inwood, Dalip Sondhi, Alex Dimitriades, Richard Davies, Caroline Brazier, Peter O'Brien, Madeleine Madden",11,Australia,1,"December 14, 2018",Friday,14,12,2018,2018,TV-MA,,1,1,"Crime TV Shows, International TV Shows, TV Dramas",3
80191369,TV Show,LOST SONG,,,"Konomi Suzuki, Yukari Tamura, Misaki Kuno, Chiaki Takahashi, Seiichiro Yamashita, Asami Seto, Yu Serizawa, Ai Kayano, Tsuyoshi Koyama, Yuto Suzuki, Mitsuru Ogata, Hiroshi Ito",12,Japan,1,"October 5, 2018",Friday,5,10,2018,2018,TV-14,,1,1,"Anime Series, International TV Shows",2
80191522,TV Show,Paradise PD,,,"Tom Kenny, David Herman, Sarah Chalke, Kyle Kinane, Dana Snyder, Cedric Yarbrough, Grey Griffin, John DiMaggio, Roger Black, Waco O'Guin",10,United States,1,"August 31, 2018",Friday,31,8,2018,2018,TV-MA,,1,1,TV Comedies,1
80191680,TV Show,White Gold,,,"Ed Westwick, James Buckley, Joe Thomas, Lauren O'Rourke, Linzey Cocker, Nigel Lindsay, Lloyd Hutchinson, Lee Ross",8,United Kingdom,1,"May 17, 2019",Friday,17,5,2019,2019,TV-MA,,2,1,"British TV Shows, International TV Shows, TV Comedies",3
80191975,TV Show,Reggie Yates Outside Man,,,Reggie Yates,1,United Kingdom,1,"December 15, 2017",Friday,15,12,2017,2017,TV-MA,,2,1,"British TV Shows, Docuseries, International TV Shows",3
80192098,TV Show,La casa de papel,,,"Úrsula Corberó, Itziar Ituño, Álvaro Morte, Paco Tous, Enrique Arce, Pedro Alonso, María Pedraza, Alba Flores, Miguel Herrán, Jaime Lorente, Esther Acebo, Darko Peric, Kiti Mánver",13,Spain,1,"July 19, 2019",Friday,19,7,2019,2019,TV-MA,,3,1,"Crime TV Shows, International TV Shows, Spanish-Language TV Shows",3
80192136,Movie,Alejandro Riaño: Especial de stand up,,,Alejandro Riaño,1,Colombia,1,"January 10, 2018",Wednesday,10,1,2018,2018,TV-MA,60,0,0,Stand-Up Comedy,1
80192445,Movie,Heroin(e),Elaine McMillion Sheldon,1,,,United States,1,"September 12, 2017",Tuesday,12,9,2017,2017,TV-14,40,0,0,Documentaries,1
80192577,TV Show,Champions,,,"Anders Holm, Fortune Feimster, Andy Favreau, J.J. Totah, Mouzam Makkar, Yassir Lester, Robert Costanzo, Ginger Gonzaga, Mindy Kaling",9,United States,1,"March 8, 2019",Friday,8,3,2019,2018,TV-14,,1,1,TV Comedies,1
80192627,Movie,Empire of Scents,Kim Nguyen,1,,,"Canada, France, Italy, Morocco, United States",5,"January 1, 2018",Monday,1,1,2018,2014,TV-14,87,0,0,"Documentaries, International Movies",2
80192734,TV Show,Barbie Dreamhouse Adventures,,,"America Young, Kirsten Day, Cassandra Morris, Cassidy Naber, Ritesh Rajan",5,United States,1,"February 14, 2019",Thursday,14,2,2019,2018,TV-Y,,3,1,Kids' TV,1
80192834,Movie,Reversing Roe,,,"Ricki Stern, Annie Sundberg",2,United States,1,"September 13, 2018",Thursday,13,9,2018,2018,TV-14,100,0,0,Documentaries,1
80192950,TV Show,The Real Football Factories,,,Danny Dyer,1,United Kingdom,1,"December 29, 2017",Friday,29,12,2017,2006,TV-MA,,1,1,"British TV Shows, Docuseries, International TV Shows",3
80193475,TV Show,A Little Help with Carol Burnett,,,"Carol Burnett, Russell Peters, Mark Cuban, Taraji P. Henson, Brittany Snow, Wanda Sykes, Derek Hough, Billy Eichner, Lisa Kudrow, Candace Cameron Bure, DJ Khaled, Tony Hale, Julie Bowen",13,United States,1,"May 4, 2018",Friday,4,5,2018,2018,TV-G,,1,1,"Stand-Up Comedy & Talk Shows, TV Comedies",2
