show_id,type,title,director,director_num,cast,cast_num,country,country_num,date_added,weekday_added,day_added,month_added,year_added,release_year,rating,duration,season,serial,listed_in,listed_in_num
80095532,TV Show,One Day at a Time,,,"Justina Machado, Rita Moreno, Todd Grinnell, Isabella Gomez, Marcel Ruiz, Stephen Tobolowsky",6,United States,1,"February 8, 2019",Friday,8,2,2019,2019,TV-PG,,3,1,TV Comedies,1
80095626,TV Show,Hibana: Spark,,,"Kento Hayashi, Kazuki Namioka, Mugi Kadowaki, Masao Yoshii, Hideaki Murata, Nahana, Sayaka Yamamoto, Shota Sometani, Tomorowo Taguchi, Kaoru Kobayashi",10,Japan,1,"June 2, 2016",Thursday,2,6,2016,2016,TV-MA,,1,1,"International TV Shows, TV Dramas",2
80095649,TV Show,We're Lalaloopsy,,,"Mariee Devereux, Kazumi Evans, Maryke Hendrikse, Matt Hill, Diana Kaarina, Jocelyne Loewen, Sabrina Pitre",7,United States,1,"January 10, 2017",Tuesday,10,1,2017,2017,TV-Y,,1,1,"Kids' TV, TV Comedies",2
80095697,TV Show,Disenchantment,,,"Abbi Jacobson, Eric André, Nat Faxon, John DiMaggio, Tress MacNeille, Matt Berry, David Herman, Maurice LaMarche, Lucy Montgomery, Billy West",10,United States,1,"September 20, 2019",Friday,20,9,2019,2019,TV-14,,2,1,"TV Action & Adventure, TV Comedies, TV Sci-Fi & Fantasy",3
80095698,TV Show,Dear White People,,,"Logan Browning, Brandon P. Bell, DeRon Horton, Antoinette Robertson, John Patrick Amedori, Ashley Blaine Featherson, Marque Richardson, Giancarlo Esposito",8,United States,1,"August 2, 2019",Friday,2,8,2019,2019,TV-MA,,3,1,"TV Comedies, TV Dramas",2
80095699,TV Show,Easy,,,"Aubrey Plaza, Judy Greer, Jane Adams, Zazie Beetz, Kate Berlant, Aya Cash, Michael Chernus, Kiersey Clemons, Orlando Bloom, Malin Akerman, Marc Maron, Dave Franco, Hannibal Buress, Jake Johnson, Emily Ratajkowski, Andrew Bachelor",16,United States,1,"May 10, 2019",Friday,10,5,2019,2019,TV-MA,,3,1,"TV Comedies, TV Dramas",2
80095815,TV Show,Santa Clarita Diet,,,"Drew Barrymore, Timothy Olyphant, Liv Hewson, Skyler Gisondo",4,United States,1,"March 29, 2019",Friday,29,3,2019,2019,TV-MA,,3,1,"TV Comedies, TV Horror, TV Thrillers",3
80095866,TV Show,Secrets of Great British Castles,,,Dan Jones,1,United Kingdom,1,"April 1, 2019",Monday,1,4,2019,2016,TV-PG,,1,1,"British TV Shows, Docuseries, International TV Shows",3
80095900,TV Show,Haters Back Off,,,"Colleen Ballinger, Angela Kinsey, Steve Little, Francesca Reale, Erik Stocklin, Matt Besser",6,United States,1,"October 20, 2017",Friday,20,10,2017,2017,TV-PG,,2,1,"TV Comedies, Teen TV Shows",2
80095988,TV Show,Stretch Armstrong & the Flex Fighters,,,"Scott Menville, Steven Yeun, Ogie Banks, Wil Wheaton, Keith David, Miguel Ferrer, David Kaye, Kate Mulgrew, Nazneen Contractor, Felicia Day",10,United States,1,"September 7, 2018",Friday,7,9,2018,2018,TV-Y7-FV,,2,1,Kids' TV,1
80096545,TV Show,Roman Empire: Reign of Blood,,,"Sean Bean, Aaron Jakubenko, Edwin Wright, Mike Edward, Genevieve Aitken, John Bach, Tai Berdinner-Blades, Jared Turner, Andrew Foster, Calum Gittins, Shane Bartle, Ella Becroft, Lisa Chappell, Emma Fenton, Phil Brown, Carl Bland, Adam Gardiner",17,"Canada, United States",2,"April 5, 2019",Friday,5,4,2019,2019,TV-MA,,3,1,Docuseries,1
80097034,TV Show,Doctor Foster,,,"Suranne Jones, Bertie Carvel, Clare-Hope Ashitey, Cheryl Campbell, Jodie Comer, Victoria Hamilton, Martha Howe-Douglas, Adam James, Thusitha Jayasundera, Sara Stewart, Neil Stuke, Tom Taylor, Robert Pugh, Shazia Nicholls, Cian Barry, Megan Roberts, Charlie Cunniffe, Navin Chowdhry",18,United Kingdom,1,"March 31, 2018",Saturday,31,3,2018,2017,TV-MA,,2,1,"British TV Shows, International TV Shows, Romantic TV Shows",3
80097072,TV Show,NATURE: Natural Born Hustlers,,,Kevin Draine,1,United States,1,"March 1, 2017",Wednesday,1,3,2017,2016,TV-G,,1,1,"Docuseries, Science & Nature TV",2
80097140,TV Show,Altered Carbon,,,"Joel Kinnaman, James Purefoy, Martha Higareda, Renée Elise Goldsberry, Dichen Lachman, Will Yun Lee, Kristin Lehman, Chris Conner, Ato Essandoh, Tamara Taylor, Byron Mann",11,United States,1,"February 2, 2018",Friday,2,2,2018,2018,TV-MA,,1,1,"Crime TV Shows, TV Action & Adventure, TV Dramas",3
80097141,TV Show,Godless,,,"Jeff Daniels, Michelle Dockery, Jack O'Connell, Scoot McNairy, Merritt Wever, Thomas Brodie-Sangster, Sam Waterston, Tantoo Cardinal",8,United States,1,"November 22, 2017",Wednesday,22,11,2017,2017,TV-MA,,1,1,TV Dramas,1
80097225,TV Show,Kiss Me First,,,"Tallulah Haddon, Simona Brown, Matthew Beard, Matthew Aubrey",4,"United Kingdom, United States",2,"June 29, 2018",Friday,29,6,2018,2018,TV-MA,,1,1,"British TV Shows, Crime TV Shows, International TV Shows",3
80097248,TV Show,Masha's Spooky Stories,,,,,"United States, Russia",2,"October 1, 2016",Saturday,1,10,2016,2012,TV-Y,,1,1,Kids' TV,1
80097321,Movie,Audrie & Daisy,"Bonni Cohen, Jon Shenk",2,,,United States,1,"September 23, 2016",Friday,23,9,2016,2016,TV-14,99,0,0,Documentaries,1
80097376,Movie,The Lovers and the Despot,"Robert Cannan, Ross Adam",2,,,United Kingdom,1,"February 23, 2017",Thursday,23,2,2017,2016,TV-14,98,0,0,"Documentaries, International Movies",2
80097438,Movie,Holy Hell,Will Allen,1,,,United States,1,"September 1, 2016",Thursday,1,9,2016,2016,NR,103,0,0,Documentaries,1
80097466,Movie,Newtown,Kim A. Snyder,1,,,United States,1,"April 7, 2017",Friday,7,4,2017,2016,NR,84,0,0,Documentaries,1
80097468,Movie,The Bad Kids,"Keith Fulton, Louis Pepe",2,,,United States,1,"April 1, 2017",Saturday,1,4,2017,2016,TV-MA,101,0,0,Documentaries,1
80097475,Movie,When Two Worlds Collide,"Heidi Brandenburg, Mathew Orzel",2,,,"Peru, United States, United Kingdom",3,"November 30, 2016",Wednesday,30,11,2016,2016,TV-14,103,0,0,"Documentaries, International Movies",2
80097532,TV Show,Bob Ross: Beauty Is Everywhere,,,Bob Ross,1,,,"June 1, 2016",Wednesday,1,6,2016,1991,TV-G,,1,1,TV Shows,1
80097594,TV Show,B: The Beginning,,,"Hiroaki Hirata, Yuki Kaji, Asami Seto, Hiroki Touchi, Minoru Inaba, Ami Koshimizu, Toshiyuki Toyonaga, Shintaro Tanaka, Atsushi Goto, Toshiyuki Morikawa, Kaito Ishikawa, Satomi Sato, Yu Kitada, Mitsuki Saiga, Kazuya Nakai, Nozomi Kameda, Makoto Awane",17,Japan,1,"March 2, 2018",Friday,2,3,2018,2018,TV-MA,,1,1,"Anime Series, Crime TV Shows, International TV Shows",3
80097726,TV Show,The Hunt,,,David Attenborough,1,United Kingdom,1,"May 14, 2017",Sunday,14,5,2017,2015,TV-PG,,1,1,"British TV Shows, Docuseries, Science & Nature TV",3
80097771,TV Show,A Very Secret Service,,,"Hugo Becker, Wilfred Benaïche, Christophe Kourotchkine, Karim Barras, Bruno Paviot, Jean-Édouard Bodziak, Mathilde Warnier, Joséphine de La Baume, Marie-Julie Baup, Antoine Gouy, Julie Farenc",11,France,1,"July 30, 2018",Monday,30,7,2018,2018,TV-14,,2,1,"International TV Shows, TV Comedies",2
80098046,TV Show,12 Years Promise,,,"So-yeon Lee, Namkoong Min, Tae-im Lee, So-hui Yoon, Won-keun Lee, Hyo-young Ryu",6,South Korea,1,"May 22, 2017",Monday,22,5,2017,2014,TV-14,,1,1,"International TV Shows, Korean TV Shows, Romantic TV Shows",3
80098047,TV Show,Last,,,"Kye-sang Yoon, Beom-su Lee, Ye-ji Seo, Won-sang Park, Ye-jin Park, Hyung-jin Gong, Jong-jun Jeong, Se-ha Ahn, Jae-yee Goo, Yong-woo Lee",10,South Korea,1,"May 22, 2017",Monday,22,5,2017,2015,TV-14,,1,1,"Crime TV Shows, International TV Shows, Korean TV Shows",3
80098305,Movie,The Sunshine Makers,Cosmo Feilding-Mellen,1,,,United Kingdom,1,"March 9, 2017",Thursday,9,3,2017,2015,TV-MA,91,0,0,"Documentaries, International Movies",2
80099305,Movie,The Fear of 13,David Sington,1,,,United Kingdom,1,"June 1, 2016",Wednesday,1,6,2016,2015,TV-MA,95,0,0,"Documentaries, International Movies",2
80099656,TV Show,Frontier,,,"Jason Momoa, Landon Liboiron, Alun Armstrong, Jessica Matten, Zoe Boyle, Allan Hawco, Evan Jonigkeit, Katie McGrath",8,Canada,1,"November 23, 2018",Friday,23,11,2018,2018,TV-MA,,3,1,"International TV Shows, TV Action & Adventure, TV Dramas",3
80099753,TV Show,Versailles,,,"George Blagden, Alexander Vlahos, Tygh Runyan, Stuart Bowman, Evan Williams, Elisa Lasowski, Joe Sheridan, Steve Cumyn, Anna Brewster, Maddison Jaizani, Pip Torrens, Catherine Walker, Lizzie Brocheré, Geoffrey Bateman",14,"France, Canada",2,"March 29, 2019",Friday,29,3,2019,2018,TV-MA,,3,1,"International TV Shows, TV Dramas",2
80100105,TV Show,Wynonna Earp,,,"Melanie Scrofano, Shamier Anderson, Tim Rozon, Dominique Provost-Chalkley, Michael Eklund, Katherine Barrell, Greg Lawson, Natascha Girgis",8,"Canada, United States",2,"July 16, 2019",Tuesday,16,7,2019,2018,TV-14,,3,1,"International TV Shows, TV Action & Adventure, TV Dramas",3
80100106,TV Show,Dramaworld,,,"Liv Hewson, Sean Dulake, Justin Chon, Noo-Ri Bae, Sa-hee Kim, Jimmy Shubert",6,"United States, South Korea, China",3,"May 23, 2016",Monday,23,5,2016,2016,TV-14,,1,1,"Romantic TV Shows, TV Comedies, TV Dramas",3
80100172,TV Show,Dark,,,"Louis Hofmann, Oliver Masucci, Jördis Triebel, Maja Schöne, Karoline Eichhorn, Sebastian Rudolph, Anatole Taubman, Mark Waschke, Stephan Kampwirth, Anne Ratte-Polle, Andreas Pietschmann, Lisa Vicari, Michael Mendl, Angela Winkler",14,"Germany, United States",2,"June 21, 2019",Friday,21,6,2019,2019,TV-MA,,2,1,"Crime TV Shows, International TV Shows, TV Dramas",3
80100929,TV Show,Cable Girls,,,"Blanca Suárez, Nadia de Santiago, Ana Fernández, Maggie Civantos, Ana Polvorosa, Yon González, Martiño Rivas, Nico Romero, Borja Luna, Sergio Mur, Concha Velasco, Antonio Velázquez, Ernesto Alterio, Ira del Río, Angela Cremonte, Andrea Carballo",16,Spain,1,"August 9, 2019",Friday,9,8,2019,2019,TV-MA,,4,1,"International TV Shows, Romantic TV Shows, Spanish-Language TV Shows",3
80100933,TV Show,Miss Dynamite,,,"Camila Sodi, Iván Sánchez, José María de Tavira, Hugo Stiglitz, José Sefami, Mauricio Isaac, Paulina Gaitán, Mara Cuevas, Mario Zaragoza, Alejandro Durán, Emilio Savinni, Pakey Vázquez, Anilú Pardo, Claudette Maillé, Rodrigo Murray, Camila Selser, Saúl Lisazo, Eréndira Ibarra",18,Mexico,1,"May 5, 2018",Saturday,5,5,2018,2015,TV-14,,1,1,"Crime TV Shows, International TV Shows, Spanish-Language TV Shows",3
80101401,TV Show,The Deep,,,"Vincent Tong, Ashleigh Ball, Kathleen Barr, Michael Dobson, Brian Drummond",5,"Canada, Australia",2,"November 1, 2019",Friday,1,11,2019,2019,TV-Y7,,3,1,Kids' TV,1
80101609,Movie,Theo Who Lived,David Shisgall,1,,,United States,1,"December 16, 2016",Friday,16,12,2016,2016,TV-14,86,0,0,Documentaries,1
80101826,TV Show,LoliRock,,,"Kazumi Evans, Kelly Sheridan, Vincent Tong, Ashleigh Ball, Tabitha St. Germain, Mackenzie Gray, Matt Ellis, James Kirk, Chiara Zanni",9,"South Korea, France",2,"May 1, 2018",Tuesday,1,5,2018,2016,TV-Y,,2,1,Kids' TV,1
80101827,Movie,The White Helmets,Orlando von Einsiedel,1,,,United Kingdom,1,"September 16, 2016",Friday,16,9,2016,2016,TV-14,41,0,0,Documentaries,1
80101903,Movie,Mark Gatiss: A Study in Sherlock,Nathan Landeg,1,"Benedict Cumberbatch, Martin Freeman, Una Stubbs, Rupert Graves, Mark Gatiss, Steven Moffat",6,,,"May 1, 2016",Sunday,1,5,2016,2016,TV-14,29,0,0,Movies,1
80102160,TV Show,Stories by Rabindranath Tagore,Anurag Basu,1,,,India,1,"July 5, 2018",Thursday,5,7,2018,2015,TV-14,,1,1,"International TV Shows, TV Dramas",2
80102162,TV Show,Raja Rasoi Aur Anya Kahaniyan,,,,,India,1,"July 5, 2018",Thursday,5,7,2018,2014,TV-G,,1,1,"Docuseries, International TV Shows",2
80102266,TV Show,Dharmakshetra,,,"Kashmira Irani, Chandan Anand, Dinesh Mehta, Ankit Arora, Pushkar Goggiaa, Anjali Rana, Aarya DharmChand Kumar, Amit Behl, Maleeka Ghai",9,India,1,"July 5, 2018",Thursday,5,7,2018,2014,TV-14,,1,1,"International TV Shows, TV Dramas, TV Sci-Fi & Fantasy",3
80102549,TV Show,Off Camera,,,Sam Jones,1,United States,1,"June 1, 2017",Thursday,1,6,2017,2015,TV-MA,,3,1,Stand-Up Comedy & Talk Shows,1
80103006,TV Show,72 Dangerous Places to Live,,,Mitch Ryan,1,Australia,1,"June 1, 2016",Wednesday,1,6,2016,2016,TV-PG,,1,1,"Docuseries, International TV Shows, Science & Nature TV",3
80103331,TV Show,Magi: Adventure of Sinbad,,,"Daisuke Ono, Tomokazu Sugita, Takahiro Sakurai, Keiji Fujiwara, Akira Ishida, Katsuyuki Konishi, Yoko Hikasa, Ai Kayano, Takehito Koyasu, Hiroki Touchi",10,Japan,1,"July 14, 2016",Thursday,14,7,2016,2016,TV-14,,1,1,"Anime Series, International TV Shows",2
80103470,TV Show,Hostages,,,"Jonah Lotan, Ayelet Zurer, Tomer Kapon, Micha Celektar, Dar Zuzovsky, Yoav Rotman, Mickey Leon, Hilla Vidor, Nevo Kimchi, Ido Bartal, Shmil Ben Ari, Liat Stern, Michal Kalman, Yoav Levi",14,Israel,1,"July 1, 2017",Saturday,1,7,2017,2016,TV-MA,,2,1,"Crime TV Shows, International TV Shows, TV Dramas",3
80104022,TV Show,72 Cutest Animals,,,,,Australia,1,"June 1, 2016",Wednesday,1,6,2016,2016,TV-G,,1,1,"Docuseries, International TV Shows, Science & Nature TV",3
80104041,Movie,Black Man White Skin,Jose Manuel Colón,1,,,Spain,1,"June 1, 2016",Wednesday,1,6,2016,2015,TV-14,79,0,0,"Documentaries, International Movies",2
80104198,TV Show,Lost in Space,,,"Molly Parker, Toby Stephens, Max Jenkins, Taylor Russell, Mina Sundwall, Parker Posey, Ignacio Serricchio",7,United States,1,"April 13, 2018",Friday,13,4,2018,2018,TV-PG,,1,1,"TV Action & Adventure, TV Dramas, TV Sci-Fi & Fantasy",3
80104318,Movie,Silicon Cowboys,Jason Cohen,1,,,United States,1,"April 1, 2017",Saturday,1,4,2017,2016,TV-PG,77,0,0,Documentaries,1
80104622,TV Show,NSU German History X,,,"Anna Maria Mühe, Albrecht Schuch, Sebastian Urzendowsky, Almila Bagriacik, Tom Schilling, André Hennicke, Florian Lukas, Liv Lisa Fries, Sylvester Groth, Florian Stetter, Nina Gummich, Jonas Leonhardi, Ben Münchow, Maximilian Jaenisch",14,Germany,1,"July 7, 2016",Thursday,7,7,2016,2016,TV-MA,,1,1,"Crime TV Shows, International TV Shows, TV Dramas",3
80104950,TV Show,Deep,,,"Patrick Ridremont, Olivier Chantreau, Pénélope Leveque, Emmanuelle Meyssignac, Salem Kali, Yann Sundberg, Victor Viel, Victor Pontecorvo, Pierre Benoist, Swann Arlaud, Phénix Brossard, Eriq Ebouaney, Tony Harrisson",13,France,1,"July 1, 2016",Friday,1,7,2016,2016,TV-MA,,1,1,"Crime TV Shows, International TV Shows, TV Dramas",3
80104983,TV Show,Crazyhead,,,"Cara Theobold, Susan Wokoma, Riann Steele, Arinzé Kene, Lewis Reeves, Tony Curran",6,United Kingdom,1,"December 16, 2016",Friday,16,12,2016,2016,TV-MA,,1,1,"British TV Shows, International TV Shows, TV Comedies",3
80105030,TV Show,Bad Education,,,"Jack Whitehall, Mathew Horne, Sarah Solemani, Michelle Gomez, Nikki Runeckles, Kae Alexander, Layton Williams, Ethan Lawrence, Charlie Wernham, Jack Binstead, Jack Bence, Harry Enfield",12,United Kingdom,1,"December 15, 2018",Saturday,15,12,2018,2014,TV-MA,,3,1,"British TV Shows, TV Comedies",2
80105085,TV Show,Gentlemen and Gangsters,,,"David Dencik, Ruth Vega Fernandez, David Fukamachi Regnfors, Sverrir Gudnason, Andreas Kundler, Sven Nordin, Boman Oscarsson, Lars Green, Sebastian Sporsén, Amanda Ooms, Magnus Krepper, Peter Carlberg, Peter Bergared, Christopher Wagelin, Lars Helander, Emilie Jonsson",16,Sweden,1,"June 1, 2016",Wednesday,1,6,2016,2016,TV-MA,,1,1,"Crime TV Shows, International TV Shows, Romantic TV Shows",3
80105356,Movie,Alive and Kicking,Susan Glatzer,1,,,"Sweden, United States",2,"August 10, 2017",Thursday,10,8,2017,2016,TV-14,89,0,0,Documentaries,1
80105452,TV Show,Slasher,,,"Katie McGrath, Brandon Jay McLaren, Steve Byers, Dean McDermott, Patrick Garrow, Jessica Sipos, Enuka Okuma, Leslie Hope, Lovell Adams-Gray, Christopher Jacot, Paulino Nunes, Ty Olsson, Joanne Vannicola, Sebastian Pigott, Madison Cheeatow, Melinda Shankar, Kaitlyn Leeb, Rebecca Liddiard, Jefferson Brown, Jim Watson, Paula Brancati, Aaron Martin",22,"Canada, United Kingdom, United States",3,"June 27, 2019",Thursday,27,6,2019,2019,TV-MA,,3,1,"TV Horror, TV Mysteries, TV Thrillers",3
80105699,TV Show,Travelers,,,"Eric McCormack, MacKenzie Porter, Nesta Cooper, Jared Paul Abrahamson, Reilly Dolman, Patrick Gilmore",6,"Canada, United States",2,"December 14, 2018",Friday,14,12,2018,2018,TV-MA,,3,1,"Crime TV Shows, International TV Shows, TV Dramas",3
80105933,TV Show,LEGO Elves: Secrets of Elvendale,,,"Ashleigh Ball, Erin Mathews, Rebecca Husain, Kyle Rideout, Riley Murdock, Vincent Tong, Nicole Oliver, Scott McNeil, Kathleen Barr",9,United States,1,"September 1, 2017",Friday,1,9,2017,2017,TV-Y7,,1,1,Kids' TV,1
80106136,TV Show,Yo-Kai Watch,,,"Johnny Yong Bosch, J.W. Terry, Alicyn Packard, Melissa Hutchison, Pierre Holloway, Brent Pendergrass",6,United States,1,"April 1, 2016",Friday,1,4,2016,2015,TV-Y7,,1,1,"Anime Series, Kids' TV",2
80106144,Movie,Children of God,John Smithson,1,,,United Kingdom,1,"August 1, 2016",Monday,1,8,2016,1994,TV-MA,63,0,0,Documentaries,1
80106150,TV Show,Cocaine,,,,,United Kingdom,1,"August 1, 2016",Monday,1,8,2016,2005,TV-14,,1,1,"British TV Shows, Crime TV Shows, Docuseries",3
80106265,TV Show,Pacific Heat,,,"Rob Sitch, Santo Cilauro, Tom Gleisner, Rebecca Massey, Lucia Mastrantone",5,Australia,1,"December 2, 2016",Friday,2,12,2016,2016,TV-14,,1,1,"Crime TV Shows, TV Comedies",2
80106307,Movie,Extremis,Dan Krauss,1,,,United States,1,"September 13, 2016",Tuesday,13,9,2016,2016,TV-PG,25,0,0,Documentaries,1
80106338,TV Show,Edge of the Universe,,,,,United Kingdom,1,"August 1, 2016",Monday,1,8,2016,2008,TV-G,,1,1,"British TV Shows, Docuseries, Science & Nature TV",3
80106611,TV Show,Love Cuisine,,,"Lego Lee, Allison Lin, Duncan Chow, Nita Lei, Hank Wu, Calvin Lee, Fu Lei",7,Taiwan,1,"August 1, 2016",Monday,1,8,2016,2015,TV-PG,,1,1,"International TV Shows, Romantic TV Shows, TV Comedies",3
80106754,Movie,National Bird,Sonia Kennebeck,1,,,United States,1,"May 8, 2017",Monday,8,5,2017,2016,TV-MA,92,0,0,Documentaries,1
80106791,Movie,Hitler - A Career,"Joachim Fest, Christian Herrendoerfer",2,,,West Germany,1,"February 10, 2017",Friday,10,2,2017,1977,TV-MA,150,0,0,"Documentaries, International Movies",2
80107077,TV Show,Cleverman,,,"Hunter Page-Lochard, Rob Collins, Deborah Mailman, Ryan Corr, Stef Dawson, Iain Glen, Frances O'Connor, Tasma Walton, Tony Briggs",9,"Australia, New Zealand, United States",3,"October 1, 2017",Sunday,1,10,2017,2017,TV-MA,,2,1,"TV Dramas, TV Sci-Fi & Fantasy, TV Thrillers",3
80107369,TV Show,Queen of the South,,,"Alice Braga, Veronica Falcón, Justina Machado, Peter Gadiot, Hemky Madera, Gerardo Taracena",6,"United States, Mexico, Spain, Malta",4,"May 7, 2019",Tuesday,7,5,2019,2018,TV-14,,3,1,"Crime TV Shows, TV Action & Adventure, TV Dramas",3
80107514,TV Show,Border Security: America's Front Line,,,,,Canada,1,"January 1, 2020",Wednesday,1,1,2020,2018,TV-14,,2,1,"Crime TV Shows, International TV Shows, Reality TV",3
80107656,Movie,Command and Control,Robert Kenner,1,,,United States,1,"May 15, 2017",Monday,15,5,2017,2017,TV-PG,92,0,0,Documentaries,1
80107987,Movie,Hitler's Olympics,Daniel Kontur,1,,,United Kingdom,1,"August 1, 2016",Monday,1,8,2016,2016,TV-PG,44,0,0,"Documentaries, Sports Movies",2
80107990,TV Show,The Beginning of Life: The Series,Estela Renner,1,,,Brazil,1,"November 11, 2016",Friday,11,11,2016,2016,TV-PG,,1,1,"Docuseries, International TV Shows, Science & Nature TV",3
80108147,Movie,How to Win the US Presidency,Cal Saville,1,,,United States,1,"August 1, 2016",Monday,1,8,2016,2016,TV-PG,51,0,0,Documentaries,1
80108159,TV Show,Ask the StoryBots,,,"Judy Greer, Erin Fitzgerald, Fred Tatasciore, Jeff Gill, Gregg Spiridellis, Evan Spiridellis",6,United States,1,"August 2, 2019",Friday,2,8,2019,2019,TV-Y,,3,1,Kids' TV,1
80108373,TV Show,The Magic School Bus Rides Again,,,"Kate McKinnon, Miles Koseleci-Vieira, Mikaela Blake, Gabby Clarke, Leke Maceda-Rustecki, Matthew Mintz, Lynsey Pham, Birva Pandya, Kaden Stephen, Lily Tomlin",10,United States,1,"April 13, 2018",Friday,13,4,2018,2018,TV-Y,,2,1,Kids' TV,1
80108450,TV Show,El Vato,,,"El Dasa, Cristina Rodlo, Ricardo Polanco, Gustavo Egelhaaf, Mauricio Martínez, Itatí Cantoral, Arcelia Ramírez, Horacio Castelo, Fátima Molina, Leonardo Daniel, Giancarlo Vidrio, Mónica Dionne, Sebastián Ferrat, Mauricio Isaac, Aldo Gallardo, Julio Casado, Arnulfo Reyes Sanchez, José María de Tavira, Pablo Bracho, Patricio Sebastián",20,United States,1,"February 24, 2018",Saturday,24,2,2018,2017,TV-MA,,2,1,"International TV Shows, Spanish-Language TV Shows, TV Comedies",3
80108473,TV Show,La Esclava Blanca,,,"Nerea Camacho, Orián Suárez, Miguel de Miguel, Modesto Lacen, Norma Martínez, Ricardo Vesga, Viña Machado, Andrés Suárez, Natasha Klauss, Miroslava Morales",10,Colombia,1,"August 1, 2016",Monday,1,8,2016,2016,TV-14,,1,1,"International TV Shows, Spanish-Language TV Shows, TV Dramas",3
80108494,TV Show,Miss Rose,,,"Roy Chiu, Megan Lai, Paul Hsu, Tia Lee, Chunya Chao, Puff Kuo, Blaire Chang",7,Taiwan,1,"August 1, 2016",Monday,1,8,2016,2015,TV-14,,1,1,"International TV Shows, Romantic TV Shows, TV Comedies",3
80108495,TV Show,Glitch,,,"Patrick Brammall, Genevieve O'Reilly, Emma Booth, Emily Barclay, Ned Dennehy, Sean Keenan, Hannah Monson, Aaron L. McGrath, John Leary, Rodger Corser, Andrew McFarlane, Luke Arnold, Rob Collins, Pernilla August",14,Australia,1,"September 25, 2019",Wednesday,25,9,2019,2019,TV-MA,,3,1,"International TV Shows, TV Dramas, TV Horror",3
80108610,Movie,Bugs,Andreas Johnsen,1,,,"Netherlands, Denmark, France, Germany",4,"February 20, 2018",Tuesday,20,2,2018,2016,TV-G,73,0,0,"Documentaries, International Movies",2
80108613,Movie,LoveTrue,Alma Har'el,1,,,United States,1,"May 7, 2017",Sunday,7,5,2017,2016,TV-MA,82,0,0,Documentaries,1
80108773,TV Show,Office Girls,,,"Roy Chiu, Alice Ko, Tia Lee, Patrick Lee, Kuo Shu-yao, James Wen, Janel Tsai",7,Taiwan,1,"August 1, 2016",Monday,1,8,2016,2011,TV-14,,1,1,"International TV Shows, Romantic TV Shows, TV Comedies",3
80108844,TV Show,Queen of No Marriage,,,"Ethan Juan, Cheryl Yang, Harry Chang, Sylvia Yang, James Wen, Patrick Lee",6,Taiwan,1,"August 1, 2016",Monday,1,8,2016,2009,TV-14,,1,1,"International TV Shows, Romantic TV Shows, TV Comedies",3
80108846,TV Show,The Prince Who Turns into a Frog,,,"Joe Chen, Ming Dao, Sam Wang, Joyce Chao, Gino, Su Li-hsin, Wang Chuan, Ehlo Huang",8,Taiwan,1,"August 1, 2016",Monday,1,8,2016,2005,TV-14,,1,1,"International TV Shows, Romantic TV Shows, TV Comedies",3
80108847,TV Show,Two Fathers,,,"Weber Yang, Lin Yo-Wei, Megan Lai, Amanda Chou, Lucia Xie, Cherry Leung",6,Taiwan,1,"August 1, 2016",Monday,1,8,2016,2013,TV-14,,1,1,"International TV Shows, Romantic TV Shows, TV Comedies",3
80108985,TV Show,Caught on Camera,,,Nick Wallis,1,United Kingdom,1,"August 15, 2016",Monday,15,8,2016,2015,TV-14,,3,1,"British TV Shows, Crime TV Shows, Docuseries",3
80108998,Movie,Real Crime: Supermarket Heist (Tesco Bomber),,,,,United Kingdom,1,"August 15, 2016",Monday,15,8,2016,2010,TV-14,46,0,0,Documentaries,1
80109038,TV Show,You're My Destiny,,,"Joe Chen, Ethan Juan, Baron Chen, Bianca Bai, Wei-hsun Na, Tan Ai-Chen",6,Taiwan,1,"August 1, 2016",Monday,1,8,2016,2008,TV-14,,1,1,"International TV Shows, Romantic TV Shows, TV Comedies",3
80109194,TV Show,Shooter,,,"Ryan Phillippe, Omar Epps, David Marciano, Cynthia Addai-Robinson, Shantel VanSanten, Tom Sizemore",6,United States,1,"June 21, 2019",Friday,21,6,2019,2018,TV-MA,,3,1,"Crime TV Shows, TV Action & Adventure, TV Dramas",3
80109399,TV Show,Kibaoh Klashers,,,"Ben Diskin, Cherami Leigh, Dakota Basseri, Keith Silverstein, Johnny Yong Bosch, Lucien Dodge, Jamie Simone, Nicolas Roye, Robbie Daymond, Michael Sorich",10,China,1,"October 6, 2017",Friday,6,10,2017,2017,TV-Y7,,2,1,Kids' TV,1
80109415,TV Show,Gilmore Girls: A Year in the Life,,,"Lauren Graham, Alexis Bledel, Kelly Bishop, Scott Patterson, Yanic Truesdale, Matt Czuchry, Liza Weil, Milo Ventimiglia, Sean Gunn, Keiko Agena, Rose Abdoo, Melissa McCarthy",12,United States,1,"November 25, 2016",Friday,25,11,2016,2016,TV-14,,1,1,"TV Comedies, TV Dramas, Teen TV Shows",3
80109535,TV Show,The Cuba Libre Story,,,,,"France, Germany",2,"December 8, 2016",Thursday,8,12,2016,2015,TV-14,,1,1,"Docuseries, International TV Shows",2
80109536,TV Show,Skin Wars,,,"Rebecca Romijn, RuPaul, Robin Slonina, Craig Tracy",4,United States,1,"October 1, 2016",Saturday,1,10,2016,2016,TV-14,,3,1,Reality TV,1
80109551,Movie,Struggle: The Life and Lost Art of Szukalski,Irek Dobrowolski,1,,,"Poland, United States",2,"December 21, 2018",Friday,21,12,2018,2018,TV-MA,105,0,0,Documentaries,1
80109640,TV Show,Battlefield Recovery,,,,,United Kingdom,1,"August 1, 2016",Monday,1,8,2016,2016,TV-PG,,1,1,"British TV Shows, Docuseries, Reality TV",3
80111273,TV Show,Game Winning Hit,,,"Lego Lee, Alice Ko, Afalean Lu, Tsai Chen-nan, Wang Chuan, Leiya Gao, Charlize Lin",7,Taiwan,1,"September 1, 2016",Thursday,1,9,2016,2009,TV-PG,,1,1,"International TV Shows, TV Comedies, TV Dramas",3
80111275,TV Show,The Year of Happiness and Love,,,"Amber Kuo, James Wen, Weber Yang, Sonia Sui, Nien-Jen Wu, Kay Huang, Tsai Chen-nan, Lin Mei-hsiu",8,Taiwan,1,"September 1, 2016",Thursday,1,9,2016,2009,TV-14,,1,1,"International TV Shows, Romantic TV Shows, TV Comedies",3
80111554,TV Show,Love Cheque Charge,,,"George Hu, Phoebe Yuan, Hsieh Kun Da, Jay Shih, Smile Weng, Jet Chao, Jessie Chang",7,Taiwan,1,"October 1, 2016",Saturday,1,10,2016,2014,TV-14,,1,1,"International TV Shows, Romantic TV Shows, TV Comedies",3
80111556,TV Show,Murphy's Law of Love,,,"Danson Tang, Chia-ying Lee, Jolin Chien, Jenna Wang, Meng-sheng Shen, Wen-lin Fang, Wei Lin, Phoebe Huang",8,Taiwan,1,"October 1, 2016",Saturday,1,10,2016,2015,TV-14,,1,1,"International TV Shows, Romantic TV Shows, TV Comedies",3
80111614,TV Show,The Womanizer,,,"Lan Cheng-lung, Sonia Sui, James Wen, Bianca Bai, George Chang, Chung Hsin-ling, Tzu-chiang Chao, Xiao Xiao Bin",8,China,1,"September 1, 2016",Thursday,1,9,2016,2010,TV-PG,,1,1,"International TV Shows, Romantic TV Shows, TV Comedies",3
80111650,TV Show,Fall in Love with Me,,,"Aaron Yan, Tia Lee, Jack Lee, Katherine Wang, Beatrice Fang, Vince Kao, Chen Bor Jeng",7,Taiwan,1,"October 1, 2016",Saturday,1,10,2016,2014,TV-14,,1,1,"International TV Shows, Romantic TV Shows, TV Comedies",3
